date,title,short_description,article_link,image,byline,alt,outlet
2020-06-19 00:00:00,AEM EV releases VCU200 Vehicle Control Unit,"AEM EV has released a new addition to its line of vehicle control units. Built on OEM hardware, AEM’s VCUs are intended for high-performance EV street-conversion and motorsports applications. They are designed to allow the calibrator to create customized torque management strategies applicable to a range of EV systems.  In its default configuration, the new…",https://chargedevs.com/newswire/aem-ev-releases-vcu200-vehicle-control-unit/,https://468y981o84o43v2wo2600a0gcj-wpengine.netdna-ssl.com/wp-content/uploads/2020/06/AEM-EV-Releases-VCU200-Vehicle-Control-Unit-300x300.jpg,Tom Lombardo,Image not found,Charged EVs
2020-06-19 00:00:00,Formula E to resume live racing in August with six-race championship series,"Formula E, which was forced to suspend its season due to the corona crisis, will resume racing in August, at Berlin’s Tempelhof Airport. A series of six races in nine days will decide the winner of the 2019/20 ABB FIA Formula E Championship. Each pair of races will use a different track configuration. Strict safety…",https://chargedevs.com/newswire/formula-e-to-resume-live-racing-in-august-with-six-race-championship-series/,https://468y981o84o43v2wo2600a0gcj-wpengine.netdna-ssl.com/wp-content/uploads/2018/12/Formula-E-begins-season-5-with-a-new-car-and-more-powerful-battery-pack-300x300.jpg,Charles Morris,Image not found,Charged EVs
2020-06-18 00:00:00,WAVE deploys wireless charging system at Oregon bus depot,"Wireless charging pioneer Wireless Advanced Vehicle Electrification (WAVE) has deployed its wireless charging system at a bus maintenance depot operated by Josephine Community Transit, which serves Josephine County, Oregon. The system will wirelessly charge two remanufactured Zero Emission Propulsion System (ZEPS) buses from Complete Coach Works. An additional two vehicles are scheduled to go into…",https://chargedevs.com/newswire/wave-deploys-wireless-charging-system-at-oregon-bus-depot/,https://468y981o84o43v2wo2600a0gcj-wpengine.netdna-ssl.com/wp-content/uploads/2020/06/wave--300x300.jpg,Charles Morris,Image not found,Charged EVs
2020-06-18 00:00:00,Tesla and Panasonic sign new three-year battery supply deal,"Lately it’s seemed that the relationship between Tesla and Panasonic might have hit a rocky patch. The two companies have been partners at Tesla’s Nevada Gigafactory since the beginning, but more recently, they’ve been seeing other people. Last year, Tesla said Panasonic’s battery cell production was constraining Model 3 production. In February, the carmaker announced…",https://chargedevs.com/newswire/tesla-and-panasonic-sign-new-three-year-battery-supply-deal/,https://468y981o84o43v2wo2600a0gcj-wpengine.netdna-ssl.com/wp-content/uploads/2019/01/Tesla-Batteries-18650-copy-300x300.jpg,Charles Morris,Image not found,Charged EVs
2020-06-18 00:00:00,"Watch out Europe, the Chinese are coming—and they’re driving EVs","China’s formidable auto industry has so far failed to find a foothold in the North American or European markets. Many industry observers believe that the country’s prominent push for electrification has little to do with concern about climate change, and much to do with the country’s quest for a seat at the top table of…",https://chargedevs.com/newswire/watch-out-europe-the-chinese-are-coming-and-theyre-driving-evs/,https://468y981o84o43v2wo2600a0gcj-wpengine.netdna-ssl.com/wp-content/uploads/2020/06/mg_-_zs_ev_-_press_kit_-_009-300x300.jpg,Charles Morris,Image not found,Charged EVs
2020-06-17 00:00:00,Ford Mustang Mach-E buyers to receive free fill-ups from Electrify America,"Ford has announced that buyers of its upcoming Mustang Mach-E will receive a little welcome-to-electric-driving present: 250 kWh of complimentary charging at Electrify America fast charging stations. This amounts to from three to five full charges, depending on battery size. Mustang Mach-E customers also get two years of free charging at stations participating in the…",https://chargedevs.com/newswire/ford-mustang-mach-e-buyers-to-receive-free-fill-ups-from-electrify-america/,https://468y981o84o43v2wo2600a0gcj-wpengine.netdna-ssl.com/wp-content/uploads/2020/06/Ford-Mustang-Mach-E-Customers-to-Receive-Up-to-Five-Complimentary-Fill-Ups-at-Electrify-America-Charging-Stations-437-300x300.jpg,Charles Morris,Image not found,Charged EVs
2020-06-17 00:00:00,Candela Seven electric boat’s hydrofoils reduce energy consumption by 80%,"An electric boat that can fly? Wow, has James Bond heard about this? The truth about the Candela Seven electric boat is a bit less exciting, but still pretty cool. The new EV can’t actually take to the sky, but it does rise above the water in order to decrease drag and increase range. Wing-shaped…",https://chargedevs.com/newswire/candela-seven-electric-boats-hydrofoils-reduce-energy-consumption-by-80/,https://468y981o84o43v2wo2600a0gcj-wpengine.netdna-ssl.com/wp-content/uploads/2020/06/Candela-Switzerland_16-300x300.jpg,Charles Morris,Image not found,Charged EVs
2020-06-17 00:00:00,ZF CeTrax electric drive goes into production,ZF has announced that the production of its CeTrax electric drive will start in the third quarter of 2020. CeTrax will be ZF’s second electric drive to go into volume production. Bus builder Solaris has chosen CeTrax to power its new Urbino 15 LE electric bus. “CeTrax is another building block on the way to…,https://chargedevs.com/newswire/zf-cetrax-electric-drive-goes-into-production/,https://468y981o84o43v2wo2600a0gcj-wpengine.netdna-ssl.com/wp-content/uploads/2020/06/2020-05-18_PI_ZF_CeTrax_Installation_01_2-2048px-300x300.jpg,Tom Lombardo,Image not found,Charged EVs
2020-06-17 00:00:00,Volkswagen begins selling ID. Charger in Europe,"Volkswagen has started deliveries of its ID. Charger, a wall-mounted Level 2 home charger, in eight European countries. The ID. Charger can be used to charge any EV with a Type 2 connector.  It can be ordered online or from Volkswagen dealers, at an introductory price of €399. VW is teaming up with certified electrical…",https://chargedevs.com/newswire/volkswagen-begins-selling-id-charger-in-europe/,https://468y981o84o43v2wo2600a0gcj-wpengine.netdna-ssl.com/wp-content/uploads/2020/06/Volkswagen-begins-selling-ID.-Charger-in-Europe-300x300.jpg,Charles Morris,Image not found,Charged EVs
2020-06-16 00:00:00,Webinar today: DC fast charging – vehicle-side thermal challenges,"OEMs have made remarkable improvements to the EV powertrain over recent years to extend range, reduce costs, and improve the driving experience. Another key item that will help drive greater consumer acceptance of full-electric vehicles is faster charging times. Progress in achieving 400 A+ and less than 30-minute charging has been slow due to limitations…",https://chargedevs.com/newswire/dc-fast-charging-a-thermal-challenge-new-webinar/,https://468y981o84o43v2wo2600a0gcj-wpengine.netdna-ssl.com/wp-content/uploads/2020/04/TE-webinar-3.2-300x300.jpg,Charged EVs,Image not found,Charged EVs
2020-06-16 00:00:00,SVOLT launches cobalt-free batteries for Great Wall EVs,"Chinese automotive battery company SVOLT, a Great Wall Motors spin-off, has officially launched two cobalt-free batteries. In 2019, the company unveiled both the cobalt-free lithium-ion battery cells (NMx) and four-element lithium-ion battery cells (NCMA). At the product launch livestream event, SVOLT President Yang Hongxin said that the NMx battery cell rivals the NCM811 cell in…",https://chargedevs.com/newswire/svolt-launches-cobalt-free-batteries-for-great-wall-evs/,https://468y981o84o43v2wo2600a0gcj-wpengine.netdna-ssl.com/wp-content/uploads/2019/05/Li-ion-batteries-18650-AdobeStock_181493434-300x300.jpeg,Tom Lombardo,Image not found,Charged EVs
2020-06-16 00:00:00,Scandinavian telecom provider to offer EV charging solutions,"Does it make sense for phone companies to get into the EV charging game? The Norwegian firm Telenor offers a full range of telecom services in the Nordic Countries, including mobile and fixed telephony, internet access and cable TV. Now Telenor has partnered with Swedish e-mobility company CaCharge to offer charging services to Telenor’s customers…",https://chargedevs.com/newswire/scandinavian-telecom-provider-to-offer-ev-charging-solutions/,https://468y981o84o43v2wo2600a0gcj-wpengine.netdna-ssl.com/wp-content/uploads/2020/06/High-Resolution-CaCharge-charging-boxes-200417-300x300.jpg,Charles Morris,Image not found,Charged EVs
2020-06-15 00:00:00,Frequently asked questions regarding silicone thermal interface materials,"Sponsored by Momentive As electronic devices continue to get smaller, the amount of heat they dissipate continues to increase. Cooling and temperature control of these devices are needed for proper operation. Silicone thermal interface materials (TIMs), which contain a high ratio of fillers that exhibit outstanding thermal conductivity, have shown to be excellent for such…",https://chargedevs.com/newswire/frequently-asked-questions-regarding-silicone-thermal-interface-materials/,https://468y981o84o43v2wo2600a0gcj-wpengine.netdna-ssl.com/wp-content/uploads/2020/06/Figure1_Heat-sink-300x300.jpg,Charged EVs,Image not found,Charged EVs
2020-06-15 00:00:00,Nexperia’s next-gen 650 V gallium nitride (GaN) technology,"Nexperia has announced a new range of GaN FETs featuring next-generation high-voltage GaN HEMT H2 technology. The devices will be available in both TO-247 and the company’s proprietary CCPAK surface-mount packaging. Nexperia says its devices achieve superior switching FOMs and on-state performance with improved stability, and simplify application designs. Because the parts are configured as…",https://chargedevs.com/newswire/nexperias-next-gen-650-v-gallium-nitride-gan-technology/,https://468y981o84o43v2wo2600a0gcj-wpengine.netdna-ssl.com/wp-content/uploads/2020/06/Nexperia_Press_Image_GaN-300x300.gif,Tom Lombardo,Image not found,Charged EVs
2020-06-15 00:00:00,"Electric buses in Europe: 50 Solaris Urbinos for Poland, 22 Volvo buses for Norway","The Polish city of Cracow has ordered 50 Solaris Urbino 18 electric buses, along with 50 plug-in charging stations. The city’s transit agency, MPK, already operates 400 Solaris buses, including 28 electric buses. The new vehicles will be delivered within a year. The order is worth approximately 36 million euros. MPK was awarded an EU…",https://chargedevs.com/newswire/electric-buses-in-europe-50-solaris-urbinos-for-poland-22-volvo-buses-for-norway/,https://468y981o84o43v2wo2600a0gcj-wpengine.netdna-ssl.com/wp-content/uploads/2016/09/Volvo-Electric-Bus-300x300.jpg,Charles Morris,Image not found,Charged EVs
2020-06-15 00:00:00,Sensata Technologies’ new GV210 series contactors for EVs,"Sensata Technologies has announced the availability of its new GV210 series of hermetically sealed, gas-filled contactors for applications carrying up to 150 A at 12 to 900 VDC. The series is the latest addition to Sensata’s GIGAVAC brand product line, and is suitable as the main contactor for applications such as forklifts, home energy storage…",https://chargedevs.com/newswire/sensata-technologies-new-gv210-series-contactors-for-evs/,https://468y981o84o43v2wo2600a0gcj-wpengine.netdna-ssl.com/wp-content/uploads/2020/06/sensata-gv210-contactor-image-300x300.gif,Tom Lombardo,Image not found,Charged EVs
2020-06-15 00:00:00,Will Europe emerge from the pandemic as the world’s EV powerhouse?,"We’ve been reading a raft of articles speculating on how the COVID-19 health crisis will affect the EV industry. So far, the consensus is that, while the overall auto industry is heading for a very rough time, the e-mobility transformation will experience only a temporary setback, and Tesla, the world’s main producer of EVs, is…",https://chargedevs.com/newswire/will-europe-emerge-from-the-pandemic-as-the-worlds-ev-powerhouse/,https://468y981o84o43v2wo2600a0gcj-wpengine.netdna-ssl.com/wp-content/uploads/2020/06/DB2020AL00737_medium-300x300.gif,Charles Morris,Image not found,Charged EVs
2020-06-12 00:00:00,Ford COO says electric F-150 pickup and Transit van will arrive mid-2022,"Ford COO Jim Farley has announced that electric versions of the F-150 pickup and Ford Transit van will make it to market by mid-2022. He offered no further information about the vehicles. “We are No. 1 in the pickup and the van market in Western Europe and the US, and this is our chance,” Farley…",https://chargedevs.com/newswire/ford-coo-says-electric-f-150-pickup-and-transit-van-will-arrive-mid-2022/,https://468y981o84o43v2wo2600a0gcj-wpengine.netdna-ssl.com/wp-content/uploads/2020/02/All-Electric-F-150-04-300x300.jpg,Charles Morris,Image not found,Charged EVs
2020-06-11 00:00:00,China sales and impending Semi production send Tesla shares into the stratosphere,"Tesla’s stock briefly cracked the thousand-dollar mark, setting a new all-time high and raising the company’s market valuation to over $180 billion, making it the world’s most valuable automaker, after Toyota. The main impetus for the stock surge seems to have been a stellar sales report from China. Tesla sold 11,095 Shanghai-made Model 3s in…",https://chargedevs.com/newswire/china-sales-and-impending-semi-production-send-tesla-shares-into-the-stratosphere/,https://468y981o84o43v2wo2600a0gcj-wpengine.netdna-ssl.com/wp-content/uploads/2020/04/Tesla-Model-3-AdobeStock-300x300.jpeg,Charles Morris,Image not found,Charged EVs
2020-06-11 00:00:00,New ams position sensors for high-speed electric motors,"Austrian sensor manufacturer ams is introducing new position sensors to enhance the electrification of safety-critical vehicle functions such as power steering, active damper control and braking. The ams AS5147U is a magnetic rotary position sensor chip for use in electric motors that run at speeds up to 28,000 rpm. The new AS5247U is a dual…",https://chargedevs.com/newswire/new-ams-position-sensors-for-high-speed-electric-motors/,https://468y981o84o43v2wo2600a0gcj-wpengine.netdna-ssl.com/wp-content/uploads/2020/06/ams_PP_AS5147U_RGB-300x300.jpg,Tom Lombardo,Image not found,Charged EVs
2020-06-11 00:00:00,Audi’s new Artemis project will focus on new EV technologies,"Two months after taking office as Audi’s new CEO, Markus Duesmann is setting up a new unit that will be tasked with “the accelerated development of additional automobile models.” The Artemis project will focus on “new technologies for electric, highly automated driving.” Its first task is to create “a highly efficient electric car” to be…",https://chargedevs.com/newswire/audis-new-artemis-project-will-focus-on-new-ev-technologies/,https://468y981o84o43v2wo2600a0gcj-wpengine.netdna-ssl.com/wp-content/uploads/2018/11/Audi-Battery-A1511099_large-300x300.jpg,Charles Morris,Image not found,Charged EVs
2020-06-11 00:00:00,New Ford Escape PHEV offers 37 miles of electric range and record 100 MPGe efficiency,"Ford’s new Escape Plug-In Hybrid boasts an EPA-estimated 37 miles of electric range, and what Ford says is a “best-in-class” fuel economy rating of 100 MPGe combined. This Escape features Ford’s fourth-generation hybrid propulsion system, which includes a new 2.5-liter Atkinson cycle hybrid engine and continuously variable transmission. The liquid-cooled, 14.4 kWh battery is located…",https://chargedevs.com/newswire/new-ford-escape-phev-offers-37-miles-of-electric-range-and-record-100-mpge-efficiency/,https://468y981o84o43v2wo2600a0gcj-wpengine.netdna-ssl.com/wp-content/uploads/2020/06/20_FRD_ESP_46645-300x300.jpg,Charles Morris,Image not found,Charged EVs
2020-06-10 00:00:00,Vitesco and ROHM cooperate on silicon carbide power solutions,"EV powertrain supplier Vitesco Technologies and silicon carbide specialist ROHM Semiconductor have signed a development partnership under which Vitesco will use ROHM’s SiC components to increase the efficiency of its EV power electronics.  “Energy efficiency is of paramount importance in an EV. As the traction battery is the only source of energy in the vehicle,…",https://chargedevs.com/newswire/vitesco-and-rohm-cooperate-on-silicon-carbide-power-solutions/,https://chargedevs.com/wp-content/uploads/2020/06/200604_PP_Vitesco-T_-siC_ROHM-300x300.png,Tom Lombardo,Image not found,Charged EVs
2020-06-10 00:00:00,Aircraft refueling vehicle goes electric,"Passenger jets may be major consumers of fossil fuels, but the vehicles that refuel them need not be. Engineering firm Gaussin and oil giant Total, which supplies jet fuel to 280 airlines at 300 airports around the world, are jointly developing a fully electric aircraft refueller transporter (ART). The ART Full Elec (which could use…",https://chargedevs.com/newswire/aircraft-refueling-vehicle-goes-electric/,https://chargedevs.com/wp-content/uploads/2020/06/ART-Avitailleur-electrique-Total-Gaussin-300x300.png,Charles Morris,Image not found,Charged EVs
2020-06-10 00:00:00,Report: EVs will drive demand for nickel sulfate over the next decade,"In a newly-released report on the nickel sulfate industry, Roskill forecasts that the expanding EV industry will become the key driver of growth in nickel demand. In the past, the market for nickel sulfate was largely driven by the plating industry and non-Li-ion battery applications, such as NiMH and NiCd batteries, but year-over-year growth in…",https://chargedevs.com/newswire/report-evs-will-drive-demand-for-nickel-sulfate-over-the-next-decade/,https://chargedevs.com/wp-content/uploads/2019/04/Batteries-AdobeStock_247551003-1-300x300.jpeg,Tom Lombardo,Image not found,Charged EVs
2020-06-09 00:00:00,"German stimulus plan supports EVs, ICEs out fossil vehicles","Following the French government’s announcement of an auto industry bailout that included some pro-EV measures, the German government has unveiled a stimulus package that advances vehicle electrification. Chancellor Angela Merkel’s Christian Democratic Union, along with its two governing partner parties, hashed out the agreement in a marathon 21-hour negotiating session. The package, which is expected…",https://chargedevs.com/newswire/german-stimulus-plan-supports-evs-ices-out-fossil-vehicles/,https://chargedevs.com/wp-content/uploads/2014/01/CT_111913_i3PrssDrv_0527-300x300.jpg,Charles Morris,Image not found,Charged EVs
2020-06-09 00:00:00,DOT awards $130 million in nationwide Low-No grants for low-emission buses,"Federal support for EVs in the US may have dwindled, but it hasn’t disappeared. The US DOT’s Federal Transit Administration (FTA) has announced $130 million in grant selections through the Low- or No-Emission (Low-No) Grant program for 2020. The Low-No program funds the deployment of zero- and low-emission transit buses and supporting facilities. Eligible projects…",https://chargedevs.com/newswire/dot-awards-130-million-in-nationwide-low-no-grants-for-low-emission-buses/,https://chargedevs.com/wp-content/uploads/2019/04/Electric-Bus-BYD-Florida-300x300.jpg,Charles Morris,Image not found,Charged EVs
2020-06-08 00:00:00,"Download EV Charging Product Guide for designing safer, more efficient and reliable charging stations","Sponsored by Littelfuse The adoption of electric and hybrid electric vehicles depends on a network of charging stations. Consumers don’t want to run out of juice in a place where they cannot recharge their vehicles. Adoption also depends on reductions in charging time, the goal being to get EV charging time on par with a…",https://chargedevs.com/newswire/download-ev-charging-product-guide-for-designing-safer-more-efficient-and-reliable-charging-stations/,https://chargedevs.com/wp-content/uploads/2020/06/Littelfuse-Electric-Vehicle-Charging-Capabilities-Brochure-1-300x300.gif,Charged EVs,Image not found,Charged EVs
2020-06-08 00:00:00,"Battery swapping is back: NIO Power has completed more than 500,000 swaps","Remember battery swapping? Following Tesla’s abandonment of the concept, and the spectacular rise and fall of Better Place, most in the EV industry probably wrote it off as a failed transitional technology. However, over in China, NIO has been diligently improving its battery swapping technology. The company introduced its Power Swap system in December 2017,…",https://chargedevs.com/newswire/battery-swapping-is-back-nio-power-has-completed-more-than-500000-swaps/,https://chargedevs.com/wp-content/uploads/2020/06/np-battery-swaps-heroes-01-300x300.jpg,Charles Morris,Image not found,Charged EVs
2020-06-08 00:00:00,AMTE Power and Britishvolt sign MoU for UK battery gigafactory,AMTE Power and Britishvolt have announced plans to collaborate on what they call the UK’s first full-cycle battery cell “GigaPlant.” The parties have signed a memo of understanding (MoU) focused on the companies’ complementary ambitions to create and expand an onshore manufacturing supply chain. The collaboration would enable scalable production of a diverse portfolio of…,https://chargedevs.com/newswire/amte-power-and-britishvolt-sign-mou-for-uk-battery-gigafactory/,https://chargedevs.com/wp-content/uploads/2018/08/Batteries-AdobeStock_141418979-300x300.jpeg,Tom Lombardo,Image not found,Charged EVs
2020-06-08 00:00:00,"Air pollution returns to “normal,” as new study shows EVs save $10,000 each in health costs","Amid the hardships of the recent pandemic-inspired lockdowns, some saw signs of hope for the future in the clear skies and quiet streets. Could the views of distant mountains from Los Angeles to New Delhi be made permanent? The object lesson provided by the lockdowns was that, if we want cleaner air, we know how…",https://chargedevs.com/newswire/air-pollution-returns-to-normal-as-new-study-shows-evs-save-10000-each-in-health-costs/,https://chargedevs.com/wp-content/uploads/2019/04/Charging-station-EV-Plugged-in-AdobeStock_143939982-300x300.jpeg,Charles Morris,Image not found,Charged EVs
2020-06-05 00:00:00,Polestar announces partnership with European charging network Plugsurfing,"EV startup Polestar has begun production of its Polestar 2 in Luqiao, China, and hopes to begin deliveries this summer, starting in Europe and followed by China and North America. Now Polestar has announced a partnership with European public charging network Plugsurfing, which will give Polestar 2 drivers in Belgium, Germany, the Netherlands, Norway, Sweden,…",https://chargedevs.com/newswire/polestar-announces-partnership-with-european-charging-network-plugsurfing/,https://chargedevs.com/wp-content/uploads/2020/06/Polestar_Plugsurfing-copy-300x300.jpg,Charles Morris,Image not found,Charged EVs
2020-06-05 00:00:00,Octillion provides batteries for Lightning Systems e-trucks and new mobile charger,Battery provider Octillion Power Systems will collaborate with Colorado-based Lightning Systems to produce Class 6 electric trucks (up to 12.5 tons) aimed at “middle-mile” delivery routes between warehouses and distribution centers. Lightning’s fuel cell-powered Class 6 truck offered by Plug Power will be available in the third quarter of 2020. Lightning’s all-electric version of the…,https://chargedevs.com/newswire/octillion-provides-batteries-for-lightning-systems-e-trucks-and-new-mobile-charger/,https://chargedevs.com/wp-content/uploads/2020/06/All-electric-and-electric-fuel-cell-powered-models-of-Chevrolet’s-6500XD-Low-Cab-Forward-model-powered-by-Octillion-batteries-are-offered-by-Lightning-Systems-and-Plug-Power-copy-300x300.jpg,Charles Morris,Image not found,Charged EVs
2020-06-04 00:00:00,"Tesla greens up Berlin Gigafactory plans, hopes to start production in one year","Tesla is reworking plans for its Berlin-area Gigafactory to answer criticism from environmental groups, a local government official told Bloomberg. The EV trendsetter has faced concerns from locals about deforestation and water usage. In February, the company was forced to temporarily halt construction. New blueprints to be presented in the next couple of weeks will…",https://chargedevs.com/newswire/tesla-greens-up-berlin-gigafactory-plans-hopes-to-start-production-in-one-year/,https://468y981o84o43v2wo2600a0gcj-wpengine.netdna-ssl.com/wp-content/uploads/2019/01/Tesla-Batteries-18650-copy-300x300.jpg,Charles Morris,Image not found,Charged EVs
2020-06-04 00:00:00,Electric Cessna Grand Caravan makes historic maiden flight,"Magnix, a maker of electric powertrains for aircraft, collaborated with engineering and flight test specialist AeroTEC to test an electric Cessna 208B Grand Caravan that they claim is the largest all-electric aircraft yet flown. The 30-minute maiden flight, which took place at an airfield near Moses Lake, Washington, was “flawless,” according to the test pilot….",https://chargedevs.com/newswire/electric-cessna-grand-caravan-makes-historic-maiden-flight/,https://468y981o84o43v2wo2600a0gcj-wpengine.netdna-ssl.com/wp-content/uploads/2020/06/70389_ecaravanchaseplane4_49973-copy-300x300.jpg,Charles Morris,Image not found,Charged EVs
2020-06-04 00:00:00,New report forecasts blockchain-based EV charging and grid integration market,"A new report from Guidehouse Insights provides forecasts for blockchain-enabled charging hardware deployment, electricity demand from blockchain-based platforms, and revenue from EV charging and integration applications through 2029. According to the report, the combined market for blockchain-based EV charging and grid integration is expected to exceed $1 billion by 2029 at a 77.9% compound annual…",https://chargedevs.com/newswire/new-report-forecasts-blockchain-based-ev-charging-and-grid-integration-market/,https://468y981o84o43v2wo2600a0gcj-wpengine.netdna-ssl.com/wp-content/uploads/2019/11/Cloud-EV-Charging-Plugged-in-AdobeStock_275870577-Converted-300x300.jpg,Tom Lombardo,Image not found,Charged EVs
