date,title,short_description,article_link,image,byline,alt,outlet
2020-03-09 00:00:00,Latest NVH Simulator expands EV sound and vibration modeling ability,"Brüel & Kjær Sound & Vibration Measurement has released version 2019.1 of its NVH Simulator. The release expands the ability to model electric and hybrid vehicles, along with over 200 other improvements and enhancements. Dave Bogema, Product Manager with Brüel & Kjær, explains: “One of the challenges associated with electric vehicle sound is the phenomena",https://chargedevs.com/newswire/latest-nvh-simulator-expands-ev-sound-modeling-ability/,https://468y981o84o43v2wo2600a0gcj-wpengine.netdna-ssl.com/wp-content/uploads/2020/03/NVH_simulator__2019_1_small-300x300.jpg,Tom Lombardo,Image not found,Charged EVs
2020-03-08 00:00:00,"Bakery giant Bimbo to build 1,000 electric trucks per year","The dynamics of the commercial vehicle market are very different from those of the fashion-driven passenger vehicle market. When it comes to electric trucks, it’s fleet buyers who are taking the initiative, from Germany’s Deutsche Post to Amazon to UPS. Now the bakery giant Grupo Bimbo has announced plans to build its own EVs. Mexico",https://chargedevs.com/newswire/bakery-giant-bimbo-to-build-1000-electric-trucks-per-year/,https://468y981o84o43v2wo2600a0gcj-wpengine.netdna-ssl.com/wp-content/uploads/2020/03/Grupo-Bimbo-Vehiculos-Electricos-Flotilla-Sustentable-01-300x300.png,Charles Morris,Image not found,Charged EVs
2020-03-08 00:00:00,Canada approves Koben Systems’ GENIUS energy management system,"Measurement Canada has approved revenue-grade metering for Koben Systems’ GENIUS, an energy management system for residential, retail and commercial sites. GENIUS serves as a micro-grid controller that can integrate solar, battery storage, wind, generators and EV technology.  Replacing the conventional electrical panel, GENIUS enables control and monitoring of energy consumption for individual circuits. The panel",https://chargedevs.com/newswire/canada-approves-koben-systems-genius-energy-management-system/,https://468y981o84o43v2wo2600a0gcj-wpengine.netdna-ssl.com/wp-content/uploads/2020/03/KobenImage_1-300x300.jpg,Dyllan Furness,Image not found,Charged EVs
2020-03-06 00:00:00,Porsche opens 7 MW rapid charging park in Germany,"Porsche Leipzig is expanding the charging infrastructure for EVs in central Germany with its new Porsche Turbo Charging park. Porsche claims that the 7 MW facility, which is supplied entirely by renewable energy sources, is Europe’s most powerful rapid charging park.  The facility includes four 22 kW AC charging points, twelve publicly-available CCS2 350 kW",https://chargedevs.com/newswire/porsche-opens-7-mw-rapid-charging-park-in-germany/,https://468y981o84o43v2wo2600a0gcj-wpengine.netdna-ssl.com/wp-content/uploads/2020/03/PLG_Charger_20200212_455598_MarcoProsch-300x300.jpg,Tom Lombardo,Image not found,Charged EVs
2020-03-05 00:00:00,BMW releases details of concept i4 EV,"The long-awaited successor to the pioneering i3 is on the way. BMW has unveiled the i4 Gran Coupe, a four-door premium midsize coupe. The company is presenting it as a concept, but says it will enter production in 2021. The new EV features the fifth generation of BMW’s eDrive powertrain—the electric motor, power electronics, charging",https://chargedevs.com/newswire/bmw-releases-details-of-concept-i4-ev/,https://468y981o84o43v2wo2600a0gcj-wpengine.netdna-ssl.com/wp-content/uploads/2020/03/BMW-releases-details-of-concept-i4-EV1-300x300.jpg,Charles Morris,Image not found,Charged EVs
2020-03-04 00:00:00,"GM shows 12 future EVs, new Ultium battery system","General Motors opened the doors of its Design Center Wednesday to show off a promised lineup of future electric vehicles to be sold in North America by Chevrolet, Cadillac, GMC, and Buick—a dozen vehicles all told, part of the 20 new EVs by 2023 it promised more than two years ago. Sadly, the journalist-only event",https://chargedevs.com/newswire/gm-shows-12-future-evs-new-ultium-battery-system/,https://468y981o84o43v2wo2600a0gcj-wpengine.netdna-ssl.com/wp-content/uploads/2020/03/GMEVDay02-300x300.jpg,John Voelcker,Image not found,Charged EVs
2020-03-04 00:00:00,Workhorse C-Series electric delivery trucks earn EPA Certificate of Conformity,"Electric truck maker Workhorse Group (NASDAQ: WKHS) has been around for a while—Charged wrote about the company’s plug-in pickup back in 2017—and it continues to make steady progress. Now the company has announced that its new C-Series electric delivery trucks have each received an EPA Certificate of Conformity, confirming that the new vehicles conform to",https://chargedevs.com/newswire/workhorse-c-series-electric-delivery-trucks-earn-epa-certificate-of-conformity/,https://468y981o84o43v2wo2600a0gcj-wpengine.netdna-ssl.com/wp-content/uploads/2020/03/Workhorse-C-Series-Vehicles-2-300x300.png,Charles Morris,Image not found,Charged EVs
2020-03-03 00:00:00,GKN developing new versions of eDrive technology as sales increase,"GKN Automotive is accelerating its eDrive development program to keep pace with growing demand for its compact electric driveline systems. In July 2019, the company produced its one millionth unit; sales in 2020 are on track to exceed 2019 figures by 141 percent. By 2025, the company expects to be producing around one million eDrive",https://chargedevs.com/newswire/gkn-developing-new-versions-of-edrive-technology-as-sales-increase/,https://468y981o84o43v2wo2600a0gcj-wpengine.netdna-ssl.com/wp-content/uploads/2019/12/gkn-resize-350x350-description-1-300x300.jpg,Charged EVs,Image not found,Charged EVs
2020-03-02 00:00:00,"GreenPower delivers 35 electric buses, reports revenue growth","GreenPower Motor Company, a Canadian manufacturer of electric buses for the transit, shuttle, tourist and school sectors, has announced results for the quarter ended in December. The company sold or leased a record 35 electric buses during the period: 33 of its EV Star Class 4 shuttles and two Synapse Type D school buses. Thirty",https://chargedevs.com/newswire/greenpower-delivers-35-electric-buses-reports-revenue-growth/,https://468y981o84o43v2wo2600a0gcj-wpengine.netdna-ssl.com/wp-content/uploads/2020/02/GreenPower-schoolbus-shuttle-bus-300x300.jpg,Charles Morris,Image not found,Charged EVs
2020-03-01 00:00:00,Tesla partners with New Jersey Turnpike to install 56 new fast chargers,"The New Jersey Turnpike Authority has approved an agreement with Tesla that will bring new fast chargers to eight Turnpike service areas, increasing the total number of individual chargers on the Turnpike from 20 to 76. Once the project is complete, there will be EV charging facilities at nine of the twelve New Jersey Turnpike",https://chargedevs.com/newswire/tesla-partners-with-new-jersey-turnpike-to-install-56-new-fast-chargers/,https://468y981o84o43v2wo2600a0gcj-wpengine.netdna-ssl.com/wp-content/uploads/2020/02/Tesla-Supercharger-Stock-300x300.jpeg,Charles Morris,Image not found,Charged EVs
2020-03-01 00:00:00,"Report: cobalt supply for EV batteries is adequate for now, but should be scaled up to meet future demands","The growth of the EV market depends on the continued availability of key materials such as cobalt, an element used in battery cathodes. Scientists from the American Chemical Society (ACS) wanted to find out if planned cobalt expansions could keep pace with this rapid growth. Their research, published in the ACS journal Environmental Science &",https://chargedevs.com/newswire/report-cobalt-supply-for-ev-batteries-is-adequate-for-now-but-should-be-scaled-up-to-meet-future-demands/,https://468y981o84o43v2wo2600a0gcj-wpengine.netdna-ssl.com/wp-content/uploads/2020/03/EV-Battery-Pack-Stock-300x300.jpeg,Charged EVs,Image not found,Charged EVs
2020-03-01 00:00:00,Tesla now scheduling Model Y deliveries,"Tesla started low-volume production of the new Model Y in January, months ahead of schedule, and is now beginning to confirm Model Y deliveries to customers. Buyers from around the country have reported receiving emails from Tesla offering delivery on or after March 15: “Congratulations! Your Model Y is ready for delivery in March 2020.”",https://chargedevs.com/newswire/tesla-now-scheduling-model-y-deliveries/,https://468y981o84o43v2wo2600a0gcj-wpengine.netdna-ssl.com/wp-content/uploads/2020/02/Tesla-Model-Y-300x300.jpg,Charles Morris,Image not found,Charged EVs
2020-02-27 00:00:00,Trump’s effort to weaken auto emissions standards is foiled on two fronts,"One of the Trump administration’s top priorities has been rolling back environmental regulations, and this is one area in which it has been ruthlessly efficient. The New York Times estimates that, to date, this administration has killed or watered down some 100 environmental protections. However, one big prize continues to elude the administration’s wrecking crew:",https://chargedevs.com/newswire/trumps-effort-to-weaken-auto-emissions-standards-is-foiled-on-two-fronts/,https://468y981o84o43v2wo2600a0gcj-wpengine.netdna-ssl.com/wp-content/uploads/2019/11/Trump-EV-Plug-in-Vehicles-Images-300x300.png,Charles Morris,Image not found,Charged EVs
2020-02-27 00:00:00,Ohio utility orders 250 Lordstown Endurance electric pickups,"The latest electrification news from what some are calling Northeast Ohio’s Voltage Valley: Akron, Ohio-based FirstEnergy, an electric utility that serves over 6 million customers, has agreed to buy 250 Endurance electric pickup trucks from Lordstown Motors. Lordstown is aiming its Endurance pickup truck squarely at the fleet market. The onboard power export feature enables",https://chargedevs.com/newswire/ohio-utility-orders-250-lordstown-endurance-electric-pickups/,https://468y981o84o43v2wo2600a0gcj-wpengine.netdna-ssl.com/wp-content/uploads/2020/02/Lordstown-Endurance-300x300.png,Charles Morris,Image not found,Charged EVs
2020-02-27 00:00:00,Does Tesla have a game-changing new battery cell in the pipeline?,"There’s little dispute that Tesla has a substantial head start in terms of battery tech vis a vis the legacy automakers. Now Electrek has reported that Tesla has a secret project called “Roadrunner” that could soon enable the company to produce much cheaper battery cells on a massive scale. For some time, it’s been apparent",https://chargedevs.com/newswire/does-tesla-have-a-game-changing-new-battery-cell-in-the-pipeline/,https://468y981o84o43v2wo2600a0gcj-wpengine.netdna-ssl.com/wp-content/uploads/2019/10/a-stock-Editorial_Use_Only-1-2-300x300.jpeg,Charles Morris,Image not found,Charged EVs
2020-02-27 00:00:00,MIT team develops novel solid electrolytes and pure lithium anodes,New research from MIT could lead to batteries that pack more power per pound and last longer. A new paper co-authored by Yuming Chen and Ziqiang Wang at MIT explores the idea of using pure lithium as the battery’s anode. The design is part of a concept for developing safe solid-state batteries by dispensing with,https://chargedevs.com/newswire/mit-team-develops-novel-solid-electrolytes-and-pure-lithium-anodes/,https://468y981o84o43v2wo2600a0gcj-wpengine.netdna-ssl.com/wp-content/uploads/2017/10/Lithium-Ion-Batter-18650-AdobeStock-300x300.jpeg,Charged EVs,Image not found,Charged EVs
2020-02-27 00:00:00,AKASOL orders fully automated production lines for new high-energy battery module plant,"AKASOL has adopted Tesla’s nomenclature, and christened its new battery plant in Darmstadt, Germany “Gigafactory 1.” The German battery maker has commissioned Manz to supply fully automated production lines for high-energy battery modules at the new plant and the company’s US site in Hazel Park, Michigan. The total order volume for production equipment could reach",https://chargedevs.com/newswire/akasol-orders-fully-automated-production-lines-for-new-high-energy-battery-module-plant/,https://468y981o84o43v2wo2600a0gcj-wpengine.netdna-ssl.com/wp-content/uploads/2020/02/AKASOL-ORDERS-FIRST-FULLY-AUTOMATED-PRODUCTION-LINES-FOR-THE-NEW-GIGAFACTORY-1-IN-DARMSTADT-300x300.jpg,Charged EVs,Image not found,Charged EVs
2020-02-27 00:00:00,SAE publishes recommended practices for automated EV charging systems,"As the EV market expands, there’s a pressing need for more standardization of DC power distribution, especially for buses and heavy-duty vehicles. SAE International’s new standard SAE J-3105: Electric Vehicle Power Transfer System Using Conductive Automated Connection Devices Recommended Practice promotes the safe testing and performance of mechanized conductive power transfer systems, primarily for vehicles",https://chargedevs.com/newswire/sae-publishes-recommended-practices-for-automated-ev-charging-systems/,https://468y981o84o43v2wo2600a0gcj-wpengine.netdna-ssl.com/wp-content/uploads/2020/02/Volvo-7900_Electric_lineup_CCS_2019-300x300.jpg,Charged EVs,Image not found,Charged EVs
2020-02-26 00:00:00,Lordstown electric pickup to use in-wheel motors. A good idea?,"Lordstown Motors, the startup headed by Workhorse CEO Steve Burns, is building an electric pickup called the Endurance at a former GM factory in Lordstown, Ohio. The Endurance is expected to be available in the fourth quarter of 2020 at a base price of $52,500. The new e-pickup will feature in-wheel hub electric motors, according",https://chargedevs.com/newswire/lordstown-electric-pickup-to-use-in-wheel-motors-a-good-idea/,https://468y981o84o43v2wo2600a0gcj-wpengine.netdna-ssl.com/wp-content/uploads/2020/02/Lordstown-in-wheel-motor--300x300.png,Charles Morris,Image not found,Charged EVs
2020-02-26 00:00:00,TDK invests in Germany electric VTOL company AutoFlightX,"TDK Ventures has dipped into its $50-million corporate venture capital fund to invest in electric vertical takeoff and landing (eVTOL) company AutoFlightX. With their ability to navigate dangerous or hard-to-reach environments, eVTOL vehicles can help eliminate human risk in mining inspections, or deliver payloads of supplies and medicine in emergency response scenarios. AutoFlightX says it",https://chargedevs.com/newswire/tdk-invests-in-germany-electric-vtol-company-autoflightx/,https://468y981o84o43v2wo2600a0gcj-wpengine.netdna-ssl.com/wp-content/uploads/2020/02/autoflightx--300x300.jpg,Charged EVs,Image not found,Charged EVs
2020-02-25 00:00:00,Webinar: Next generation circuit protection in EVs,"The vehicle electrification era is here, bringing with it a wave of innovative technologies and exponential advancements. However, there are important safety implications to be considered as power, voltages, and charging rates are increasing. To learn more about next-generation circuit protection in EVs, tune in to this webinar presented by Eaton. The session will be",https://chargedevs.com/newswire/webinar-next-generation-circuit-protection-in-evs/,https://468y981o84o43v2wo2600a0gcj-wpengine.netdna-ssl.com/wp-content/uploads/2020/02/Eaton-Webinar-300x300.jpg,Charged EVs,Image not found,Charged EVs
2020-02-25 00:00:00,Nickel used in EV batteries increased 39% in 2019,"Nickel deployment in passenger EV batteries totaled 59,271 tonnes in 2019, according to Adamas Intelligence, representing an increase of 39% from 2018. BEVs were responsible for 76% of passenger battery nickel use globally in 2019, up from 71% in 2018. The sales-weighted average amount of nickel deployed per EV globally in 2019 was 12.9 kilograms,",https://chargedevs.com/newswire/nickel-use-in-ev-batteries-increased-39-in-2019/,https://468y981o84o43v2wo2600a0gcj-wpengine.netdna-ssl.com/wp-content/uploads/2019/07/Batteries-18650AdobeStock_247551003-300x300.jpg,Dyllan Furness,Image not found,Charged EVs
2020-02-25 00:00:00,Greenlots partners with Ivy Charging Network in Ontario,"Greenlots, a provider of charging and energy management solutions that was acquired by Shell last year, has partnered with Ivy Charging Network, a fast charging network recently launched by utilities Hydro One and Ontario Power Generation (OPG). The new deal includes the installation of 100 DC fast chargers (DCFCs) at 43 sites along major highway",https://chargedevs.com/newswire/greenlots-partners-with-ivy-charging-network-in-ontario/,https://468y981o84o43v2wo2600a0gcj-wpengine.netdna-ssl.com/wp-content/uploads/2020/02/Greenlots-partners-with-Ivy-Charging-Network-in-Ontario-300x300.png,Dyllan Furness,Image not found,Charged EVs
2020-02-25 00:00:00,Norwegian wholesaler ASKO deploys 2 Scania electric trucks,"Norwegian wholesaler ASKO will deploy two Scania electric trucks in Oslo as part of a pilot project. Each of the two-speed, 27-ton trucks has a battery capacity of 165 kWh and range of 120 km (75 miles). The 290 kW electric powertrain offers 245 kW of continuous output and 2,200 Nm of torque. The vehicles",https://chargedevs.com/newswire/norwegian-wholesaler-asko-deploys-2-scania-electric-trucks/,https://468y981o84o43v2wo2600a0gcj-wpengine.netdna-ssl.com/wp-content/uploads/2020/02/pr2-oslo-lds-300x300.png,Dyllan Furness,Image not found,Charged EVs
2020-02-24 00:00:00,"BASF to build battery materials plant in Germany, supplying up to 400,000 EVs per year","Chemical company BASF announced a new battery materials production site in Schwarzheide, Germany, as part of its multi-step investment in Europe’s EV value chain. The new plant will produce cathode active materials with an initial capacity enabling the supply of around 400,000 pure EVs per year with BASF battery materials. The company says the Schwarzheide",https://chargedevs.com/newswire/basf-to-build-battery-materials-plant-in-germany-supplying-up-to-400000-evs-per-year/,https://468y981o84o43v2wo2600a0gcj-wpengine.netdna-ssl.com/wp-content/uploads/2020/02/BASF-SE--300x300.jpg,Charged EVs,Image not found,Charged EVs
2020-02-24 00:00:00,Utility EDF acquires EV charging company Pod Point,"Low-carbon energy provider EDF has acquired Pod Point, an EV charging company. Pod Point has rolled out 62,000 charging points in the UK and 6,600 in Norway. The acquisition follows EDF’s acquisition last year of Pivot Power, which specializes in grid-scale batteries and provides high-voltage power for EV charge points. Simone Rossi, UK CEO of",https://chargedevs.com/newswire/utility-edf-acquires-ev-charging-company-pod-point/,https://468y981o84o43v2wo2600a0gcj-wpengine.netdna-ssl.com/wp-content/uploads/2020/02/edf_59546197462-copy-300x300.jpg,Dyllan Furness,Image not found,Charged EVs
2020-02-24 00:00:00,Hydro-Québec commercializing electrolyte patents for solid-state batteries,"The University of Texas at Austin has agreed to transfer patents relating to a new type of electrolyte to be used in solid-state lithium batteries to Hydro-Québec, Canada’s largest electricity producer. The patents are co-invented by Dr. John B. Goodenough—a professor at The University of Texas at Austin and the 2019 Nobel Laureate in chemistry—and",https://chargedevs.com/newswire/hydro-quebec-commercializing-electrolyte-patents-for-solid-state-batteries/,https://468y981o84o43v2wo2600a0gcj-wpengine.netdna-ssl.com/wp-content/uploads/2014/06/Solid-State-Battery1-300x300.jpg,Charged EVs,Image not found,Charged EVs
2020-02-21 00:00:00,Nidec launches 50 kW and 200 kW motor systems for EVs,"Nidec has launched two new models of traction motor systems: a 200 kW model for the D and E segments and a 50 kW model for the A segment. Both models are based on Nidec’s 150 kW E-Axle. Targeting luxury EVs for the European and Chinese markets, the 200 kW model features a motor and",https://chargedevs.com/newswire/nidec-launches-50-kw-and-200-kw-motor-systems-for-evs/,https://468y981o84o43v2wo2600a0gcj-wpengine.netdna-ssl.com/wp-content/uploads/2020/02/Ni200Ex-300x300.png,Dyllan Furness,Image not found,Charged EVs
2020-02-21 00:00:00,95.6 GWh of EV battery capacity deployed in 2019,"In 2019, 95.6 GWh of battery capacity was deployed globally in new passenger EVs, an increase of 30% over the prior year, according to a tracking system developed by Adamas Intelligence. Asia Pacific led the pack with 50.9 GWh deployed, an increase of 27% year-over-year. Europe followed with 23.9 GWh deployed, a large increase of",https://chargedevs.com/newswire/95-6-gwh-of-ev-battery-capacity-deployed-in-2019/,https://468y981o84o43v2wo2600a0gcj-wpengine.netdna-ssl.com/wp-content/uploads/2020/02/EV-Plugged-in-Charging-Batteries-Stock-AdobeStock_315287877-300x300.jpeg,Charged EVs,Image not found,Charged EVs
2020-02-21 00:00:00,Wärtsilä selects Corvus Energy batteries for Finnlines ferries,"Wärtsilä has selected Corvus Energy to supply energy storage systems for three new hybrid ferries for Finnlines, a Finish ferry operator. Designed for roll-on/roll-off cargo, each ferry has a length of 238 meters, a beam of 34 meters, a capacity of 5,800 lane-meters, and more than 5,000 meter-square of vehicle decks. Built at Nanjing shipyard,",https://chargedevs.com/newswire/wartsila-selects-corvus-energy-batteries-for-finnlines-ferries/,https://468y981o84o43v2wo2600a0gcj-wpengine.netdna-ssl.com/wp-content/uploads/2020/02/1788.03-Finnlines-RoRo-newbuilding-300x300.jpg,Dyllan Furness,Image not found,Charged EVs
2020-02-20 00:00:00,"Tesla to use prismatic cells for Chinese Model 3, says new report","From the beginning, Tesla’s use of readily available cylindrical battery cells gave it an advantage over other EV-makers, which used proprietary prismatic or pouch cells. In 2015, JB Straubel explained why Tesla was sticking with cylindrical cells, even though others found it a controversial decision. Over the years, many writers have noted Tesla’s battery tech",https://chargedevs.com/newswire/tesla-to-use-prismatic-cells-for-chinese-model-3-says-new-report/,https://468y981o84o43v2wo2600a0gcj-wpengine.netdna-ssl.com/wp-content/uploads/2020/02/Tesla-Batteries-300x300.jpg,Charles Morris,Image not found,Charged EVs
2020-02-20 00:00:00,Decreasing the risk of electrical shorts in Li-ion battery cells,"Sponsored by Chroma System Solutions On rare occasions, an electrical short can develop inside a cell after passing production tests. This is due to burrs or particles on the positive electrode reaching the negative electrode after inflation occurs. If these cells that are susceptible to failure pass through to the end user, the results could be",https://chargedevs.com/newswire/decreasing-the-risk-of-electrical-shorts-in-li-ion-battery-cells/,https://468y981o84o43v2wo2600a0gcj-wpengine.netdna-ssl.com/wp-content/uploads/2020/02/CSS_1200X628_11210WP-300x300.jpg,Charged EVs,Image not found,Charged EVs
2020-02-20 00:00:00,Motiv opens new California facility to service electric trucks and buses,"Motiv Power Systems, maker of the EPIC all-electric chassis for buses and trucks, has opened a new facility in Stockton, California. The new location will serve as a pre-delivery inspection and service center for EVs built on its platform. Medium-duty trucks and buses are electrified by Motiv’s operating software and power electronics on popular Ford",https://chargedevs.com/newswire/motiv-opens-new-california-facility-to-service-electric-trucks-and-buses/,https://468y981o84o43v2wo2600a0gcj-wpengine.netdna-ssl.com/wp-content/uploads/2019/10/motiv-pr-im-copy-300x300.jpg,Charged EVs,Image not found,Charged EVs
2020-02-19 00:00:00,Yamaha develops an electric motor prototype for EVs,Yamaha Motor has begun accepting orders for a high-performance electric motor prototype capable of producing high power density for EVs. The company says the compact unit generates up to 200 kW thanks to a high-efficiency segment conductor and advanced casting and processing technologies. Yamaha says the goal of the project is to deepen its knowledge,https://chargedevs.com/newswire/yamaha-develops-an-electric-motor-prototype-for-evs/,https://468y981o84o43v2wo2600a0gcj-wpengine.netdna-ssl.com/wp-content/uploads/2020/02/Yamaha-Motor-Begins-Accepting-Orders-for-High-performance-Electric-Motor-Prototype-300x300.jpg,Charged EVs,Image not found,Charged EVs
2020-02-19 00:00:00,"Malmö, Sweden orders 60 Volvo high-capacity electric buses","Scandinavian transport operator Nobina, which services Malmo, Sweden, has ordered 60 of Volvo’s 7900 Electric Articulated electric buses. Propelled by dual electric motors with a two-speed transmission, the buses have a maximum power output of 400 kW and maximum torque of 31 kN-m at the driven axle, with battery capacity have up to 396 kWh",https://chargedevs.com/newswire/malmo-sweden-orders-60-volvo-high-capacity-electric-buses/,https://468y981o84o43v2wo2600a0gcj-wpengine.netdna-ssl.com/wp-content/uploads/2020/02/Volvo-bus-1860x1050-7900-EA-Skanetrafiken-2019-newsintro-300x300.jpg,Dyllan Furness,Image not found,Charged EVs
2020-02-19 00:00:00,ROHM’s new shunt resistors feature novel high heat dissipation structure,Semiconductor manufacturer ROHM has announced new shunt resistors ideal for current detection in motors and power supply circuits used in EVs and industrial equipment. The GMR50 series of resistors deliver 4 W rated power (at electrode temperature TK=90° C) in the compact 5.0 mm × 2.5 mm (2010 type package) size. Shunt resistors are widely,https://chargedevs.com/newswire/rohms-new-shunt-resistors-feature-novel-high-heat-dissipation-structure/,https://468y981o84o43v2wo2600a0gcj-wpengine.netdna-ssl.com/wp-content/uploads/2020/02/RAHM-059_GMR50_EN_1-300x300.jpg,Charged EVs,Image not found,Charged EVs
