date,title,short_description,article_link,image,byline,alt,outlet
2020-01-13 00:00:00,Northvolt’s battery recycling program aims to source 50% recycled material by 2030,"Swedish battery maker Northvolt is launching a new program, Revolt, that is devoted to recycling lithium-ion batteries. It plans to bring a pilot recycling plant online in Västerås, Sweden, in 2020, next to its existing manufacturing plant. The plant will handle NMC and NCA Li-ion chemistries. It will serve as a platform for developing and",https://chargedevs.com/newswire/northvolts-battery-recycling-program-aims-to-source-50-recycled-material-by-2030/,https://468y981o84o43v2wo2600a0gcj-wpengine.netdna-ssl.com/wp-content/uploads/2020/01/Northvolt_Cells-300x300.jpg,Ryan Austin,Image not found,Charged EVs
2020-01-13 00:00:00,Wallbox’s bidirectional DC home charger turns heads at CES,"Bidirectional charging encompasses several applications that can be collectively referred to as V2x (vehicle-to-grid, vehicle-to-home, maybe someday vehicle-to-brain). It’s expected to play an important role in tomorrow’s electrified, connected transportation ecosystem, but to date it exists only in pilots, most of them involving commercial fleets. So the new Quasar bidirectional EV charger from Barcelona-based Wallbox,",https://chargedevs.com/newswire/wallboxs-bidirectional-dc-home-charger-turns-heads-at-ces/,https://468y981o84o43v2wo2600a0gcj-wpengine.netdna-ssl.com/wp-content/uploads/2020/01/Quasar-garage-3-300x300.png,Charles Morris,Image not found,Charged EVs
2020-01-11 00:00:00,Hummer to be reborn as GM electric pickup truck,"We’ve often accused the legacy automakers of lacking imagination, but now we see that at least someone at GM has a sense of irony. The company’s first announced electric pickup truck will be called a Hummer. GM will not be reviving the Hummer make, which choked to death in 2010, but will sell the Hummer",https://chargedevs.com/newswire/hummer-to-be-reborn-as-gm-electric-pickup-truck/,https://468y981o84o43v2wo2600a0gcj-wpengine.netdna-ssl.com/wp-content/uploads/2020/01/Hummer-AdobeStock_-300x300.jpeg,Charles Morris,Image not found,Charged EVs
2020-01-09 00:00:00,Volvo unveils heavy-duty concept EVs for construction and regional transport,"Volvo Trucks has developed electric concept trucks for construction operations and regional distribution to gauge commercial interest. The company plans to have select European customers pilot a small number of these concept vehicles, which it plans to commercialize in the future. Volvo points out that heavy-duty e-trucks can improve the work environment for drivers and",https://chargedevs.com/newswire/volvo-unveils-heavy-duty-concept-evs-for-construction-and-regional-transport/,https://468y981o84o43v2wo2600a0gcj-wpengine.netdna-ssl.com/wp-content/uploads/2019/12/electric-concept-trucks-hi-res-image-2-300x300.jpg,Ryan Austin,Image not found,Charged EVs
2020-01-09 00:00:00,IBM unveils heavy metal-free battery that performs better than Li-ion,IBM Research has unveiled new battery materials extracted from seawater that it says could help eliminate the need for dangerous heavy metals in battery production. Use of the three new proprietary materials create a battery chemistry that does not use heavy metals or other substances that suffer from concerns about sourcing. Beyond the environmental and,https://chargedevs.com/newswire/ibm-unveils-heavy-metal-free-battery-that-performs-better-than-li-ion/,https://468y981o84o43v2wo2600a0gcj-wpengine.netdna-ssl.com/wp-content/uploads/2018/08/Batteries-AdobeStock_181493577-300x300.jpeg,Ryan Austin,Image not found,Charged EVs
2020-01-09 00:00:00,Siemens Mobility leads build-out of local charging network in West of England,"Following the launch of local public charging network Revive, Siemens Mobility is working with Alfen and ENGIE EV Solutions (formerly ChargePoint Services) to deliver new charging hubs and more than 120 new EV connections across the West of England. Revive is a public charging network that will feature four dedicated charging hubs around Bristol, Bath,",https://chargedevs.com/newswire/siemens-mobility-leads-build-out-of-local-charging-network-in-west-of-england/,https://468y981o84o43v2wo2600a0gcj-wpengine.netdna-ssl.com/wp-content/uploads/2019/12/Siemens-Mobility-Revive-091219-300x300.jpeg,Ryan Austin,Image not found,Charged EVs
2020-01-09 00:00:00,Momentive’s thermal gap fillers perform well during hot vibration testing,"Sponsored by Momentive Performance Materials With the onset of ever-shrinking electronic components and systems with more functionality and power in the automotive industry, the demand for thermal management materials, such as gap fillers, have rapidly increased over the past several years. Together, with the continuing trend of reducing device dimensions, this has led to a",https://chargedevs.com/newswire/momentives-thermal-gap-fillers-perform-well-during-hot-vibration-testing/,https://468y981o84o43v2wo2600a0gcj-wpengine.netdna-ssl.com/wp-content/uploads/2019/12/Momentive’s-thermal-gap-fillers-perform-well-during-hot-vibration-testing-3-300x300.jpg,Charged EVs,Image not found,Charged EVs
2020-01-09 00:00:00,Sony’s concept EV embarrasses legacy automakers,"The surprise star of the CES tech show seems to be a concept EV from Sony. Yes, that Sony. Is everyone going to get into the EV game now? Who’s next, a vacuum cleaner company? The electric, autonomous, connected automobile is a new frontier for electronics companies, and Sony’s VISION-S is a showcase for a",https://chargedevs.com/newswire/sonys-concept-ev-embarrasses-legacy-automakers/,https://468y981o84o43v2wo2600a0gcj-wpengine.netdna-ssl.com/wp-content/uploads/2020/01/Sony’s-concept-EV-embarrasses-legacy-automakers-300x300.png,Charles Morris,Image not found,Charged EVs
2020-01-09 00:00:00,Infineon’s new 900 A IGBT chip offers 30% less static loss,"German semiconductor manufacturer Infineon has introduced a new version of its IGBT7 chip in its TRENCHSTOP line that boasts 30% less static loss than previous models. The 1,200 V module provides a leading nominal current of 900 A. Infineon says this enables a 30% higher inverter output current from the same frame size compared with",https://chargedevs.com/newswire/infineons-new-900-a-igbt-chip-offers-30-less-static-loss/,https://468y981o84o43v2wo2600a0gcj-wpengine.netdna-ssl.com/wp-content/uploads/2019/12/EconoDual3-TRENCHSTOP-IGBT7-300x300.jpg,Ryan Austin,Image not found,Charged EVs
2020-01-08 00:00:00,New Jersey set to enact a raft of pro-EV measures,"Pending legislation in New Jersey will make it one of the country’s most EV-friendly states, establishing new purchase incentives and investing substantial amounts in charging infrastructure. Assembly Bill 4819 and companion Senate Bill 2252 have been passed by their respective committees, and are expected to be signed into law this week. The legislation creates a",https://chargedevs.com/newswire/new-jersey-set-to-enact-a-raft-of-pro-ev-measures/,https://468y981o84o43v2wo2600a0gcj-wpengine.netdna-ssl.com/wp-content/uploads/2017/08/Chevy-Bolt-Fast-Charge-CCS-300x300.jpg,Charles Morris,Image not found,Charged EVs
2020-01-06 00:00:00,PowerCharge launches new commercial charging station,"PowerCharge, a division of Moser Services Group, has launched a new line of commercial charging stations designed for heavy-duty EVs. Called the Pro-Lightning Series, the chargers come in various configurations, including wall- or pedestal-mounted; open- or closed-access; and networked or non-networked. The stations also offer multiple power levels and back-end software options. Standard features include",https://chargedevs.com/newswire/powercharge-launches-new-commercial-charging-station/,https://468y981o84o43v2wo2600a0gcj-wpengine.netdna-ssl.com/wp-content/uploads/2019/12/PowerCharge™-Pro-Lightning-300x300.jpg,Dyllan Furness,Image not found,Charged EVs
2020-01-06 00:00:00,Does Tesla’s latest patent have to do with its promised million-mile battery?,"Last April, Elon Musk announced that a “1 million-mile battery pack” was in the pipeline. As a recent article posted on Forbes points out, today’s typical Li-ion battery packs are more than adequate for individual EV owners, but applications such as taxi services and long-distance trucking will require batteries optimized for longevity (according to writer",https://chargedevs.com/newswire/does-teslas-latest-patent-have-to-do-with-its-promised-million-mile-battery/,https://468y981o84o43v2wo2600a0gcj-wpengine.netdna-ssl.com/wp-content/uploads/2019/10/a-stock-Editorial_Use_Only-300x300.jpeg,Charles Morris,Image not found,Charged EVs
2020-01-06 00:00:00,ON Semiconductor introduces new power modules for high-voltage EV inverters,"ON Semiconductor has released the first two devices within its new VE-Trac family of power modules for high-voltage automotive traction inverters. Future devices in the VE-Trac family will include discrete power devices, isolated gate drivers, and wide bandgap (WBG) devices. The company says its first two devices are ideally suited for use in the main",https://chargedevs.com/newswire/on-semiconductor-introduces-new-power-modules-for-high-voltage-ev-inverters/,https://468y981o84o43v2wo2600a0gcj-wpengine.netdna-ssl.com/wp-content/uploads/2019/12/onsemiconductors-VE-TracDual-Web--300x300.jpg,Ryan Austin,Image not found,Charged EVs
2020-01-06 00:00:00,Connected Kerb to pilot wireless charging pads in England and Scotland,"Charging station manufacturer Connected Kerb, in partnership with Munich-based Magment, will begin trials of a new wireless charging system in Greater London, the English Midlands and Scotland this year. The company will install its induction pads on residential streets, at car parks and at taxi ranks. On-street charging is a hot topic in London, where",https://chargedevs.com/newswire/connected-kerb-to-pilot-wireless-charging-pads-in-england-and-scotland/,https://468y981o84o43v2wo2600a0gcj-wpengine.netdna-ssl.com/wp-content/uploads/2019/01/Wireless-Charging-300x300.jpg,Charles Morris,Image not found,Charged EVs
2020-01-06 00:00:00,Ricardo software update provides simulation for electric motorcycle powertrain design,"Ricardo has released a 2019.2 update of its powertrain design and optimization software. The company hopes the update will help customers more quickly deliver cleaner and more efficient products to market. The Ricardo development team focused on the scope, accuracy, and speed of simulation, as well as integration and co-simulation between individual analysis operations and",https://chargedevs.com/newswire/ricardo-software-update-provides-simulation-for-electric-motorcycle-powertrain-design/,https://468y981o84o43v2wo2600a0gcj-wpengine.netdna-ssl.com/wp-content/uploads/2019/12/Motorcycle-AdobeStock_272987781-300x300.jpg,Ryan Austin,Image not found,Charged EVs
2020-01-03 00:00:00,"Tesla delivers 112k vehicles in Q4, blasting through forecasts","Already riding high after reporting a profitable quarter and beginning deliveries from the Chinese Gigafactory, Tesla has delivered another body blow to the fossil auto industry. In Q4 2019, Tesla delivered 112,000 cars, exceeding expectations and blowing through the previous delivery record of 97,000 cars, which was set in Q3. We may never know to",https://chargedevs.com/newswire/tesla-delivers-112k-vehicles-in-q4-blasting-through-forecasts/,https://468y981o84o43v2wo2600a0gcj-wpengine.netdna-ssl.com/wp-content/uploads/2019/04/Tesla-S3XY-300x300.jpg,Charles Morris,Image not found,Charged EVs
2020-01-03 00:00:00,Overview of automotive radar technologies: Free poster,"Sponsored By Keysight Technologies Download or order a beautifully designed automotive radar poster. It provides an overview of the technologies that make new cars safer and more convenient, including a snapshot of radar technology from 24 to 81 GHz. Get into the fast lane with the latest technical resources on autonomous driving. Learn about the",https://chargedevs.com/newswire/free-poster-overview-of-automotive-radar-technologies/,https://468y981o84o43v2wo2600a0gcj-wpengine.netdna-ssl.com/wp-content/uploads/2019/12/Keysight-Technologies-300x300.png,Charged EVs,Image not found,Charged EVs
2020-01-02 00:00:00,IKEA deploys electric delivery truck from SEA Electric,Australian e-truck builder SEA Electric has delivered an electric delivery truck to fleet service provider All Purpose Transport. The new truck will be making deliveries for IKEA in Queensland. SEA offers a range of 5 drivetrains for commercial vehicles from 3.5 tons to 27 tons GVM. Customers can select a new cab chassis from their,https://chargedevs.com/newswire/ikea-deploys-electric-delivery-truck-from-sea-electric/,https://468y981o84o43v2wo2600a0gcj-wpengine.netdna-ssl.com/wp-content/uploads/2019/12/ANC_IKEA_917evs1-300x300.jpg,Charles Morris,Image not found,Charged EVs
2020-01-02 00:00:00,"Michigan offers up to $70,000 in grants to install EV fast chargers","The Michigan Department of Environment, Great Lakes, and Energy (EGLE) is offering grants of up to $70,000 for the installation of DC fast chargers. Successful applicants must be registered in a local utility-sponsored charging program, and can use their grant money for charger site preparation, equipment installation, networking fees, and signage. Part of the more",https://chargedevs.com/newswire/michigan-offers-up-to-70000-in-grants-to-install-ev-fast-chargers/,https://468y981o84o43v2wo2600a0gcj-wpengine.netdna-ssl.com/wp-content/uploads/2019/04/ABB-EVI_Interop-300x300.jpg,Dyllan Furness,Image not found,Charged EVs
2020-01-02 00:00:00,GNK Automotive launches new electric drive systems,"GNK Automotive, a maker of electric driveline technology, has launched three families of electric drive systems, each of which integrates an electric motor and inverter with a single-speed transmission module. GKN Automotive’s Family 2 eDrive offers peak torque of 1,800 to 2,700 Nm, and is suitable for A-, B-, and C-segment applications. The company’s Family",https://chargedevs.com/newswire/gnk-automotive-launches-new-electric-drive-systems/,https://468y981o84o43v2wo2600a0gcj-wpengine.netdna-ssl.com/wp-content/uploads/2019/12/gkn-resize-350x350-description-1-300x300.jpg,Dyllan Furness,Image not found,Charged EVs
2020-01-02 00:00:00,New report: Electric trucks and buses are a win-win-win,"A new study quantifies what commercial EV-makers have been saying for years: electric trucks and buses are a triple win. They save money for fleet operators, and reduce both local air pollution and carbon emissions. Furthermore, in California (among other places), they generate jobs and economic benefits. American bus-builder Proterra is headquartered in Silicon Valley",https://chargedevs.com/newswire/new-report-electric-trucks-and-buses-are-a-win-win-win/,https://468y981o84o43v2wo2600a0gcj-wpengine.netdna-ssl.com/wp-content/uploads/2019/04/Electric-Bus-BYD-Florida-300x300.jpg,Charles Morris,Image not found,Charged EVs
2019-12-31 00:00:00,EU approves €3.2-billion project to create more sustainable Li-ion batteries,"The European Commission recently approved a €3.2-billion research project focused on every level of the value chain of Li-ion batteries in the European market. The Commission designed the project to support the development of innovative technologies that improve charging time, battery life, safety and sustainability. The project participants will focus on four areas: Raw and",https://chargedevs.com/newswire/eu-approves-e3-2-billion-project-to-create-more-sustainable-li-ion-batteries/,https://468y981o84o43v2wo2600a0gcj-wpengine.netdna-ssl.com/wp-content/uploads/2017/10/Lithium-Ion-Batter-18650-AdobeStock-300x300.jpeg,Ryan Austin,Image not found,Charged EVs
2019-12-31 00:00:00,Electrify America chargers coming to Bank of America financial centers,"Electrify America will install 40 charging stations with a total of 140 chargers, at Bank of America financial centers in California, Georgia, Florida, Illinois, Oregon, Washington, Virginia, and Massachusetts. The chargers will offer power levels ranging from 150 kW to 350 kW. The new stations are expected to be operational by the end of 2020….  Read more »",https://chargedevs.com/newswire/electrify-america-chargers-coming-to-bank-of-america-financial-centers/,https://468y981o84o43v2wo2600a0gcj-wpengine.netdna-ssl.com/wp-content/uploads/2019/12/Small-Electrify-America-to-Install-EV-Charging-Stations-at-Bank-of-America-Financial-Center-Locations-383-300x300.jpg,Dyllan Furness,Image not found,Charged EVs
2019-12-31 00:00:00,Rivian raises $1.3 billion in funding,"Rivian, an automaker that revealed its prototype electric pickup and SUV in November 2018, has raised $1.3 billion in a recent funding round led by T. Rowe Price Associates. Amazon and Ford also participated in the funding round. Designed as all-terrain EVs, Rivian’s launch products, the R1T pickup and R1S SUV, are notable for their",https://chargedevs.com/newswire/rivian-raises-1-3-billion-in-funding/,https://468y981o84o43v2wo2600a0gcj-wpengine.netdna-ssl.com/wp-content/uploads/2019/12/2019_11_R1TGrey_SA_WideLandscape_Vista_C0086-300x300.jpg,Dyllan Furness,Image not found,Charged EVs
2019-12-30 00:00:00,Momentive’s thermal gap fillers perform well during hot vibration testing,"Sponsored by Momentive Performance Materials With the onset of ever-shrinking electronic components and systems with more functionality and power in the automotive industry, the demand for thermal management materials, such as gap fillers, have rapidly increased over the past several years. Together, with the continuing trend of reducing device dimensions, this has led to a",https://chargedevs.com/newswire/momentives-thermal-gap-fillers-perform-well-during-hot-vibration-testing/,https://468y981o84o43v2wo2600a0gcj-wpengine.netdna-ssl.com/wp-content/uploads/2019/12/Momentive’s-thermal-gap-fillers-perform-well-during-hot-vibration-testing-3-300x300.jpg,Charged EVs,Image not found,Charged EVs
2019-12-30 00:00:00,BAE to supply electric propulsion systems for buses in San Francisco’s “green zones”,"The San Francisco Municipal Transportation Agency (SFMTA) has selected BAE Systems, a UK-based maker of hybrid and electric drive systems, to supply electric power and propulsion systems for the transit agency’s buses. BAE’s Series-ER system will operate on 68 SFMTA buses. San Francisco plans to create nine zero-emission “green zones” in densely populated neighborhoods throughout",https://chargedevs.com/newswire/bae-to-supply-electric-propulsion-systems-for-buses-in-san-franciscos-green-zones/,https://468y981o84o43v2wo2600a0gcj-wpengine.netdna-ssl.com/wp-content/uploads/2019/12/BAE-Green-Zones-Image-4-300x300.jpg,Dyllan Furness,Image not found,Charged EVs
2019-12-29 00:00:00,Five vehicle interoperability principles that are critical to EV market success,"Sponsored by ABB By Heather Flanagan, Marketing Manager of EV Infrastructure at ABB Inc. Charging standards are far more mature than they were a few years ago when the first production EV’s were landing in the hands of early adopters. EVs and related charging technologies have continued to evolve, keeping the whole industry on its",https://chargedevs.com/newswire/five-vehicle-interoperability-principles-that-are-critical-to-ev-market-success/,https://468y981o84o43v2wo2600a0gcj-wpengine.netdna-ssl.com/wp-content/uploads/2019/12/ABB-Connectors-300x300.jpg,Charged EVs,Image not found,Charged EVs
2019-12-29 00:00:00,Tesla activates Trans-Canadian Supercharger route,"This may not be as momentous an occasion as the 1869 opening of the Transcontinental Railroad – but almost. Tesla’s Trans-Canada Supercharger route, which has been under construction for over a year, is now operational, allowing Tesla drivers to take the northern route from coast to coast. Most of the locations are equipped with Tesla’s",https://chargedevs.com/newswire/tesla-activates-trans-canadian-supercharger-route/,https://468y981o84o43v2wo2600a0gcj-wpengine.netdna-ssl.com/wp-content/uploads/2019/12/Telsa-supercharger-canada-300x300.png,Charles Morris,Image not found,Charged EVs
2019-12-29 00:00:00,Nexeon acquires 24 patents for silicon anodes,"Silicon anode specialist Nexeon has acquired three sets of patents relating to the use of silicon in lithium-ion battery anodes. The 24 patents cover the manufacture and use of nano-scale silicon particles, alone or combined with graphite, as well as methods for coating carbon particles with silicon using vapor deposition. The patents have global coverage,",https://chargedevs.com/newswire/nexeon-acquires-24-patents-for-silicon-anodes/,https://468y981o84o43v2wo2600a0gcj-wpengine.netdna-ssl.com/wp-content/uploads/2019/12/Nexeon-acquires-24-patents-for-silicon-anodes-300x300.jpg,Ryan Austin,Image not found,Charged EVs
2019-12-27 00:00:00,Gentherm and GM find microclimate comfort system reduces energy use up to 69% in cold weather,"Gentherm, a developer of thermal management technologies, has published the results of a study it performed in partnership with GM to understand the real-world effectiveness of a ‘microclimate’ comfort system in reducing energy use in EVs. The study found that Gentherm’s ClimateSense microclimate comfort system increases driving range and energy savings. As part of the",https://chargedevs.com/newswire/gentherm-and-gm-find-microclimate-comfort-system-reduces-energy-use-up-to-69-in-cold-weather/,https://468y981o84o43v2wo2600a0gcj-wpengine.netdna-ssl.com/wp-content/uploads/2019/12/Gentherm-TMSS_2019-6-300x300.png,Ryan Austin,Image not found,Charged EVs
2019-12-27 00:00:00,California bans time-based billing for EV charging,"California’s Office of Administrative Law has approved amendments to its Electric Vehicle Fueling Systems Specifications. Effective January 1, 2020, the new rules will ban public charging operators from billing by the minute. This is likely to cause some turmoil in the charging market, as several major charging networks, including Electrify America and EVgo, currently bill",https://chargedevs.com/newswire/california-bans-time-based-billing-for-ev-charging/,https://468y981o84o43v2wo2600a0gcj-wpengine.netdna-ssl.com/wp-content/uploads/2013/11/California-Nicolas-Raymond-300x300.jpg,Charles Morris,Image not found,Charged EVs
2019-12-26 00:00:00,The need for high-temperature capacitors in DC link buses,"Sponsored by Knowles Precision Devices Today’s advancements in power electronics are reaching all-new highs in performance. In the quest for increasing efficiency and power density of converters and inverters, manufacturers are looking to use WBG semiconductors, such as gallium nitride (GaN) and silicon carbide (SiC), for making metal-oxide semiconductor field-effect transistors (MOSFETs), metal-semiconductor field-effect transistors (MESFETs)",https://chargedevs.com/newswire/the-need-for-high-temperature-capacitors-in-dc-link-buses/,https://468y981o84o43v2wo2600a0gcj-wpengine.netdna-ssl.com/wp-content/uploads/2019/11/Knowles-Capacitors-HITECA_WP_V3-1-1-300x300.jpg,Charged EVs,Image not found,Charged EVs
2019-12-26 00:00:00,Freebee deploys Lightning Systems’ EVs for on-demand public transport,"Freebee, a Florida-based operator of on-demand public transit vehicles, has ordered six Lightning Electric Ford Transit 350 HD passenger vans from Lightning Systems. Freebee, which offers passengers free door-to-door rides through municipal transportation contracts, has received two of the six vans and put them into service shortly after delivery. The vans are supported by Lightning",https://chargedevs.com/newswire/freebee-deploys-lightning-systems-evs-for-on-demand-public-transport/,https://468y981o84o43v2wo2600a0gcj-wpengine.netdna-ssl.com/wp-content/uploads/2019/12/freebee_photo_1200px-300x300.jpg,Dyllan Furness,Image not found,Charged EVs
2019-12-26 00:00:00,SAE works to develop common Public Key Infrastructure for Plug & Charge,"The Plug & Charge system, which will enable EV charging with no need for a membership card or smartphone app, is expected to be operational in 2020. In order to support a more secure implementation of Plug & Charge, SAE International plans to form an industry-led research project to create a common Public Key Infrastructure",https://chargedevs.com/newswire/sae-works-to-develop-common-public-key-infrastructure-for-plug-charge/,https://468y981o84o43v2wo2600a0gcj-wpengine.netdna-ssl.com/wp-content/uploads/2017/08/Chevy-Bolt-Fast-Charge-CCS-300x300.jpg,Dyllan Furness,Image not found,Charged EVs
2019-12-26 00:00:00,Feinmetall’s new 600 A cell contacts skirt oxidation issues,"Feinmetall, a maker of contacts for Li-ion cells, has introduced new contact technologies in its new line of high-current contacts, including a new technique to avoid oxidation problems on contacts. One of its new new high-current blocks, the HC01, is suitable for contacting prismatic and pouch cells and allows continuous currents up to 600 amps….  Read more »",https://chargedevs.com/newswire/feinmetalls-new-600-a-cell-contacts-skirt-oxidation-issues/,https://468y981o84o43v2wo2600a0gcj-wpengine.netdna-ssl.com/wp-content/uploads/2019/12/a8696eb8a7-300x300.jpg,Ryan Austin,Image not found,Charged EVs
