date,title,short_description,article_link,image,byline,alt,outlet
2019-10-14,Tesla Model 3 excluded from Edmunds list of best EVs under $40k,"Edmunds released its list of the best electric vehicles under $40,000, highlighting the fact that you can purchase an eco-friendly vehicle without...",https://www.teslarati.com/tesla-model-3-excluded-edmunds-best-evs-under-40k/,https://www.teslarati.com/wp-content/uploads/2019/07/tesla-model-3-model-x-andres-ge-16-e1564092465824-450x270.jpg,,Image not found,Teslarati
2019-10-14,Rivian debuts new blue R1T color at customer preview event,"Rivian held a pre-order event in Seattle, Washington for its reservation holders over the weekend, unveiling a new blue color for its...",https://www.teslarati.com/rivian-r1t-blue-color-customer-seattle-event/,https://www.teslarati.com/wp-content/uploads/2019/09/Rivian-R1T-u_Rhinotjv-450x270.jpg,,Image not found,Teslarati
2019-10-14,Tesla Supercharger station spotted at China Gigafactory 3 in latest drone flyover,"Drone footage of Tesla’s Gigafactory 3 in Shanghai, China shows that the giant production plant has put into place the first set...",https://www.teslarati.com/tesla-gigafactory-3-shanghai-china-supercharger-station/,https://www.teslarati.com/wp-content/uploads/2019/09/Screen-Shot-2019-09-30-at-12.21.45-PM-1-450x270.jpg,,Image not found,Teslarati
2019-10-14,Volvo set to debut all-electric SUV built on XC40 platform on October 16,"Swedish vehicle manufacturer Volvo has announced that it will be releasing its first full-electric vehicle on October 16, and the company says...",https://www.teslarati.com/volvos-xc40-ev-debut-october-16/,https://www.teslarati.com/wp-content/uploads/2019/09/volvo-xc4-ev-electric-suv-450x270.jpg,,Image not found,Teslarati
2019-10-14,SpaceX aims to ship two new Crew Dragon spacecraft to Florida in the next two months,"Speaking in an interview with CNN shortly after presenting an update on Starship, SpaceX CEO Elon Musk says that the company’s next...",https://www.teslarati.com/spacex-crew-dragon-capsules-florida-arrival-schedule/,https://www.teslarati.com/wp-content/uploads/2019/09/Crew-Dragon-DM-1-orbit-tall-pano-SpaceX-crop-3-450x270.jpg,,Image not found,Teslarati
2019-10-14,Tesla’s liquid-cooled charging connector patent paves way for the Semi’s Megachargers,A recently published patent application from Tesla suggests that the electric car maker is continuing in its efforts to improve its already-stellar...,https://www.teslarati.com/tesla-semi-megacharger-liquid-cooled-connector-patent/,https://www.teslarati.com/wp-content/uploads/2019/09/tesla-semi-yandell-truckaway-8-e1569177146801-450x270.jpg,,Image not found,Teslarati
2019-10-14,Tesla gets ‘six-figure’ advertising slot from popular reality TV show for free,"American electric car maker Tesla was treated to a free, high-profile advertising slot in Norway, with The Farm, a popular, long-running reality...",https://www.teslarati.com/tesla-free-advertising-the-farm-norway/,https://www.teslarati.com/wp-content/uploads/2019/07/tesla-model-s-raven-1-450x270.jpg,,Image not found,Teslarati
2019-10-14,Arnold Schwarzenegger sends Tesla Model 3 for climate activist Greta Thunberg,A spokesman for former California governor Arnold Schwarzenegger has confirmed that the iconic Hollywood action star has arranged a Tesla Model 3...,https://www.teslarati.com/greta-thunberg-tesla-model-3-arnold-schwarzenegger/,https://www.teslarati.com/wp-content/uploads/2019/09/greta-thunberg-model-3-arnold-schwarzenegger-450x270.jpg,,Image not found,Teslarati
2019-10-14,Toyota doubles down on hydrogen with 2nd-gen Mirai’s 2020 release,"Toyota Chairman Takeshi Uchiyamada recently confirmed that the Japanese automaker is preparing to launch the second-generation of its hydrogen fuel-cell car, the...",https://www.teslarati.com/toyota-confirms-mirai-hyrdogen-car-2020-release/,https://www.teslarati.com/wp-content/uploads/2019/09/toyota-mirai-1a-450x270.jpg,,Image not found,Teslarati
2019-10-14,Tesla on Mars addressed by Elon Musk in SpaceX’s Starship Q&A session,"Tesla and SpaceX CEO Elon Musk spent his weekend in Boca Chica, Texas conducting a Q&A session in front of the massive...",https://www.teslarati.com/tesla-on-mars-addressed-by-elon-musk-during-spacex-starship-qa/,https://www.teslarati.com/wp-content/uploads/2019/09/Screen-Shot-2019-09-29-at-12.17.55-AM-450x270.jpg,,Image not found,Teslarati
2019-10-14,SpaceX envisions Starship-enabled cities on the Moon and Mars in new renders,SpaceX CEO Elon Musk has revealed updated renders of conceptual Moon and Mars bases that may ultimately be made possible by the...,https://www.teslarati.com/spacex-starship-enabled-moon-mars-base-renders/,https://www.teslarati.com/wp-content/uploads/2019/09/Starship-2019-Moon-base-render-SpaceX-1-450x270.jpg,,Image not found,Teslarati
2019-10-14,SpaceX debuts Starship’s new Super Heavy booster design,"Speaking on Saturday night (Sept. 28th) at the base of the SpaceX’s Starship Mk1 prototype in Boca Chica, Texas, CEO Elon Musk...",https://www.teslarati.com/spacex-ceo-elon-musk-debuts-starships-new-super-heavy-booster-design/,https://www.teslarati.com/wp-content/uploads/2019/09/Starship-Super-Heavy-Boca-Chica-launch-SpaceX-render-1-crop-450x270.jpg,,Image not found,Teslarati
2019-10-14,Tesla Model 3 unparks itself and drives to save family from torrential rainstorm,"Amid Tesla’s recent wide-release of V10 software to those who are equipped with Full-Self Driving capabilities, many owners are posting videos of...",https://www.teslarati.com/tesla-smart-summon-saves-family-rainstorm/,https://www.teslarati.com/wp-content/uploads/2019/09/tesla-model-3-summon-rain-450x270.jpg,,Image not found,Teslarati
2019-09-24,"LIVESTREAM: SpaceX CEO Elon Musk to present Starship update, talk future of humanity","SpaceX is set to livestream CEO Elon Muskâs annual Starship-focused presentation around 8 pm EDT (7 pm CDT), September 28, set to...",https://www.teslarati.com/livestream-spacex-ceo-elon-musk-presents-starship-updates-talks-future-of-humanity/,https://www.teslarati.com/wp-content/uploads/2019/09/Starship-Mk1-Boca-Chica-092719-Teslarati-Eric-Ralph-1-c-450x270.jpg,,Image not found,Teslarati
2019-09-24,Tesla Smart Summon is life-changing for drivers with mobility problems,"Teslaâs Smart Summon has been teased by CEO Elon Musk for some time, and now that itâs being rolled out with the...",https://www.teslarati.com/tesla-smart-summon-disabled-drivers-life-changing/,https://www.teslarati.com/wp-content/uploads/2019/09/tesla-smart-summon-1a-450x270.jpg,,Image not found,Teslarati
2019-09-24,"SpaceXâs Starship Mk1 halves mated to reach full stack height in Boca Chica, TX","SpaceX CEO, Elon Musk, debuted a fully stacked Starship Mk1 rocket on twitter ahead of an invite-only media event expected to take...",https://www.teslarati.com/spacexs-starship-mk1-halves-mated-to-reach-full-stack-height-in-boca-chica-tx/,https://www.teslarati.com/wp-content/uploads/2019/09/EFfmFEEU8AA1SmA-450x270.jpg,,Image not found,Teslarati
2019-09-24,Teslaâs patented magnetic Wipers demonstrated in concept video,"Teslaâs recently published patent for a new, magnetically focused wiper blade has held onto immense speculation since its first reports in early...",https://www.teslarati.com/teslas-patented-magnetic-wipers-demonstrated-in-concept-video/,https://www.teslarati.com/wp-content/uploads/2019/06/red-roadster-model-y-1-450x270.jpg,,Image not found,Teslarati
2019-09-24,"Tesla Model S police cruiser not to blame for mishap, says Fremont PD",The Fremont Police Department released a statement on Thursday evening clarifying reports that its Tesla Model S cruiser ran out of battery...,https://www.teslarati.com/tesla-model-s-police-cruiser-not-to-blame-for-mishap-says-fremont-pd/,https://www.teslarati.com/wp-content/uploads/2019/09/fremont-police-1-450x270.jpg,,Image not found,Teslarati
2019-09-24,Tesla Model 3 sets another record in the Netherlands,"The Netherlands is proving to be one of the Tesla Model 3âs most high volume markets, as reports show that the country...",https://www.teslarati.com/tesla-model-3-becomes-top-selling-car-in-the-netherlands/,https://www.teslarati.com/wp-content/uploads/2019/09/model-3-sunset-450x270.jpg,,Image not found,Teslarati
2019-09-24,SpaceX aims to launch critical Crew Dragon abort test before the end of 2019,SpaceX has applied for an FCC Special Temporary Authority license to authorize rocket communications during what is likely Crew Dragonâs In-Flight Abort...,https://www.teslarati.com/spacex-crew-dragon-in-flight-abort-test-launch-date/,https://www.teslarati.com/wp-content/uploads/2019/09/Crew-Dragon-SuperDraco-highlight-reel-Sept-2019-SpaceX-mosaic-1-450x270.jpg,,Image not found,Teslarati
2019-09-24,Rimac shares crash test video of $2M electric hypercar,Croatian electric sports car producer Rimac recently put its new C_Two hypercar through a series of rigorous crash tests in order to...,https://www.teslarati.com/rimac-crash-test-video-c_two-electric-hypercar/,https://www.teslarati.com/wp-content/uploads/2019/09/rimac-c-two-crash-tests-450x270.jpg,,Image not found,Teslarati
2019-09-24,Tesla releases Smart Summon with ability to target a specific location,"The highly-anticipated release of Teslaâs Beta version of the âSmart Summonâ feature is finally here. The company, however, added yet another great...",https://www.teslarati.com/tesla-smart-summon-geo-target-map-location/,https://www.teslarati.com/wp-content/uploads/2019/03/tesla-enhanced-summon-app-model-3-450x270.jpg,,Image not found,Teslarati
2019-09-24,SpaceX CEO Elon Musk shows off Starshipâs 3 Raptor engines in best photos yet,"SpaceX CEO Elon Musk has taken to Twitter to publish yet more photos of the companyâs Starship Mk1 rocket prototype, this time...",https://www.teslarati.com/spacex-elon-musk-best-starship-raptor-photos-yet/,https://www.teslarati.com/wp-content/uploads/2019/09/Starship-Mk1-Raptors-engine-section-view-092619-Elon-Musk-3-edit.jpg,,Image not found,Teslarati
2019-09-24,Tesla begins roll out of V10 software with several surprise convenience features,Teslaâs V10 software update rolled out for non-EAP members on the morning of September 26 and included exciting new convenience features on...,https://www.teslarati.com/tesla-v10-wide-release-mobile-app-update/,https://www.teslarati.com/wp-content/uploads/2019/09/mobile-app-v10-450x270.jpg,,Image not found,Teslarati
2019-09-24,Tesla (TSLA) gets bold âBuyâ rating and $324 price target from Chinese finance firm,"Tesla stock (NASDAQ:TSLA) recently received an optimistic outlook from a rather interesting financial firm, as Chinese investment bank China Renaissance initiated coverage...",https://www.teslarati.com/tesla-tsla-china-renaissance-buy-324-price-target/,https://www.teslarati.com/wp-content/uploads/2019/09/tesla-gigafactory-3-phase-2-1-450x270.jpg,,Image not found,Teslarati
2019-09-24,Teslaâs V10 full release notes confirms Smart Summon and Spotify streaming,Tesla appears to have started the public rollout of its V10 update. While most of V10âs features have already been teased during...,https://www.teslarati.com/tesla-v10-full-release-notes-smart-summon-spotify/,https://www.teslarati.com/wp-content/uploads/2019/09/tesla-model-3-v10-smart-summon-spotify-450x270.jpg,,Image not found,Teslarati
2019-09-24,First Tesla Model 3 body-in-white from Gigafactory 3 rolls off the line: report,Recent reports from local Chinese media have revealed that the first Tesla Model 3 body-in-white has rolled off Gigafactory 3âs assembly line. ...,https://www.teslarati.com/tesla-gigafactory-3-model-3-biw-production-begins/,https://www.teslarati.com/wp-content/uploads/2019/09/tesla-gigafcatory-3-model-3-line-2-e1569497298304-450x270.jpg,,Image not found,Teslarati
2019-09-24,SpaceXâs Starship to grow in height as workers prepare to stack its top section,"SpaceX CEO Elon Musk has teased new details and posted several new photos of Starship Mk1, taken on September 25th as employees...",https://www.teslarati.com/spacex-elon-musk-posts-new-starship-progress-photos/,https://www.teslarati.com/wp-content/uploads/2019/09/Starship-Mk1-lift-transport-092519-Elon-Musk-1-crop-450x270.jpg,,Image not found,Teslarati
2019-09-24,"Tesla to release mobile app update that allows window closing, venting features",Tesla has begun rolling out a new update for its mobile app that introduces a clever feature allowing owners to close and...,https://www.teslarati.com/tesla-v10-mobile-app-window-venting-closing-function/,https://www.teslarati.com/wp-content/uploads/2019/09/tesla-mobile-app-update-window-venting-450x270.jpg,,Image not found,Teslarati
2019-09-24,IONITY takes wraps off new 350 kW âHaloâ Tritium ultra-fast charger,Electric Vehicle charging company IONITY has unveiled a new 350 kW charger that the company anticipates will perform very well in the...,https://www.teslarati.com/ionity-takes-wraps-off-new-350-kw-halo-tritium-ultra-fast-charger/,https://www.teslarati.com/wp-content/uploads/2019/09/taycan-halo-450x270.jpg,,Image not found,Teslarati
2019-09-24,Norway gas station replaces fuel pumps with electric car fast chargers,A gas company operating in Norway recently made history when it decided to replace all of its gas pumps at one of...,https://www.teslarati.com/norway-gas-station-changes-fuel-pumps-to-tesla-ev-chargers/,https://www.teslarati.com/wp-content/uploads/2019/09/norway-fuel-pumps-ev-chargers-1-450x270.jpg,,Image not found,Teslarati
2019-09-24,Tesla Model X Raven subjected to EV veteranâs real-world efficiency test,A veteran electric vehicle enthusiast has given the Tesla Model X a nod of approval after putting the SUV through his trademark...,https://www.teslarati.com/tesla-model-x-raven-efficiency-test-video/,https://www.teslarati.com/wp-content/uploads/2019/09/Screen-Shot-2019-09-25-at-10.03.02-AM-450x270.jpg,,Image not found,Teslarati
2019-09-24,The Model Y is an understated Trojan Horse for Teslaâs manufacturing ambitions,"The launch of the Tesla Model Y is, in several ways, an understated and undramatic event. There were no surprise vehicles at...",https://www.teslarati.com/tesla-model-y-secrets-manufacturing-ambitions/,https://www.teslarati.com/wp-content/uploads/2019/09/tesla-model-y-sunset-450x270.jpg,,Image not found,Teslarati
2019-09-24,SpaceX CEO Elon Musk explains how Starships will return from orbit,"In the near future, SpaceX wants to begin putting its first two full-scale Starship prototypes through a series of increasingly challenging test...",https://www.teslarati.com/spacex-elon-musk-explains-starship-orbital-reentry/,https://www.teslarati.com/wp-content/uploads/2019/09/Boca-Chica-Starship-Mk1-092219-NASASpaceflight-bocachicagal-leg-2-6-c-450x270.jpg,,Image not found,Teslarati
2019-09-24,Tesla CEO Elon Musk gives VW CEO kind words amid automaker’s massive EV push,"Tesla CEO Elon Musk gave some support to embattled Volkswagen Chief Executive Herbert Diess on Tuesday, despite the German automaker’s legal troubles...",https://www.teslarati.com/tesla-elon-musk-kind-words-vw-ceo-sustainability/,https://www.teslarati.com/wp-content/uploads/2017/09/vw-volkswagen-dealership-450x270.jpg,,Image not found,Teslarati
2019-09-24,"Tesla’s new Gigafactory 3 jobs puts Model 3 production, grassroots marketing in focus","The start of Gigafactory 3’s operations appears to be drawing closer, with Tesla’s China division posting a series of new job listings...",https://www.teslarati.com/tesla-gigafactory-3-model-3-grassroots-marketing-jobs/,https://www.teslarati.com/wp-content/uploads/2019/09/tesla-china-social-media-team-1-450x270.jpg,,Image not found,Teslarati
2019-09-24,Porsche Taycan selected by legendary American tuner as first electric vehicle project,"Porsche’s flagship all-electric sports car, the Taycan, is set to receive some improvements from legendary American tuning house, Hennessey. President and CEO...",https://www.teslarati.com/porsche-taycan-tuning-hennessey/,https://www.teslarati.com/wp-content/uploads/2019/09/porsche-taycan-hennessey-450x270.jpg,,Image not found,Teslarati
2019-09-24,Tesla to install a Supercharger V3 station in Florida,"Clearwater, Florida will receive Tesla’s second full V3 Supercharging Station, according to permits found online. MyClearwater.com, a website local to Clearwater, Florida,...",https://www.teslarati.com/tesla-supercharger-v3-installation-florida/,https://www.teslarati.com/wp-content/uploads/2019/07/tesla-las-vegas-supercharger-v3-450x270.jpg,,Image not found,Teslarati
2019-09-24,ExxonMobil CEO dismisses electric vehicles: ‘What’s the point?’,Exxon CEO Darren Woods recently expressed his doubts about the transportation sector’s transition to electric vehicles. In comments during the 2019 Oil...,https://www.teslarati.com/exxonmobil-ceo-dismisses-evs-no-point/,https://www.teslarati.com/wp-content/uploads/2019/09/hebron-oil-drilling-450x270.jpg,,Image not found,Teslarati
2019-09-24,The Boring Company’s Las Vegas Loop tunnel project is coming to life,"The Boring Company’s upcoming Loop project at the Las Vegas Convention Center appears to be coming to life, with the first images...",https://www.teslarati.com/elon-musk-boring-company-las-vegas-loop-tunnel-update-pictures/,https://www.teslarati.com/wp-content/uploads/2019/09/TBM-CutterHead-1-450x270.jpg,,Image not found,Teslarati
2019-09-24,Volkswagen will begin development and production of lithium-ion batteries,German automaker Volkswagen has announced that it has taken steps to begin the development and production of lithium-ion battery cells to use...,https://www.teslarati.com/volkswagen-starts-battery-development-production/,https://www.teslarati.com/wp-content/uploads/2019/05/evgo-vw-egolf-1-450x270.jpg,,Image not found,Teslarati
2019-09-24,SpaceX is installing Tesla battery packs on its Starship MK1 rocket prototype,"First noticed by NASASpaceflight.com forum member “exilon”, SpaceX appears to have selected off-the-shelf Tesla battery packs as the power storage method of...",https://www.teslarati.com/spacex-starship-tesla-battery-packs-spotted/,https://www.teslarati.com/wp-content/uploads/2019/09/Boca-Chica-Starship-Mk1-092319-NASASpaceflight-bocachicagal-batteries-feature-2-c-450x270.jpg,,Image not found,Teslarati
2019-09-24,Tesla Model 3 ramps presence in Australia despite government’s questionable EV stance,"Tesla is scheduled to deliver over 2,400 units of its Model 3 to Australia this month, making it one of the top-selling...",https://www.teslarati.com/tesla-model-3-ramps-presence-in-australia-despite-governments-questionable-ev-stance/,https://www.teslarati.com/wp-content/uploads/2019/09/model-3-sunset-450x270.jpg,,Image not found,Teslarati
2019-09-24,SpaceX begins launch pad upgrades for Starship flight tests in Texas and Florida,"Beneath the buzz of Starship Mk1’s glamorous wing installation, SpaceX has begun installing new launch pad hardware meant to support the spacecraft’s...",https://www.teslarati.com/spacex-begins-starship-launch-pad-upgrades-texas-florida/,https://www.teslarati.com/wp-content/uploads/2019/09/Boca-Chica-Starship-Mk1-092219-NASASpaceflight-bocachicagal-pad-new-tanks-1-edit-c-450x270.jpg,,Image not found,Teslarati
2019-09-24,Tesla Model 3 passes Model X as 6th all-time best-selling EV in Norway,The Tesla Model 3 is making its mark in Norway as it has already become the 6th highest-selling Battery Electric Vehicle in...,https://www.teslarati.com/tesla-model-3-model-x-passes-6th-best-selling-bev-norway/,https://www.teslarati.com/wp-content/uploads/2019/07/tesla-model-3-model-x-andres-ge-25-e1564091994852-450x270.jpg,,Image not found,Teslarati
2019-09-24,Cars & Coffee group responds to Tesla owners after members block Supercharger en masse,"The organizers of Cars & Coffee Yorktown, NY have issued a pledge for change to Tesla owners after a recent meetup among...",https://www.teslarati.com/tesla-owners-supercharger-mass-iced-apology/,https://www.teslarati.com/wp-content/uploads/2019/09/cars-and-coffee-supercharger-450x270.png,,Image not found,Teslarati
2019-09-24,Tesla battery supplier for China starts mass production of Model 3 batteries: sources,"Industry sources have suggested that LG Chem, a company reportedly tapped by Tesla as one of its battery suppliers for its Shanghai-based...",https://www.teslarati.com/tesla-lg-chem-model-3-batteries-mass-production-gigafactory-3/,https://www.teslarati.com/wp-content/uploads/2019/09/tesla-battery-cells-1-450x270.jpg,,Image not found,Teslarati
2019-09-24,"SpaceX’s Starship Mk1 rocket already has three Raptors installed, says Elon Musk","In a few late-night tweets, SpaceX CEO Elon Musk offered a rare view inside the company’s Boca Chica Starship fabrication building and...",https://www.teslarati.com/spacex-starship-three-raptors-installed-says-elon-musk/,https://www.teslarati.com/wp-content/uploads/2019/09/Boca-Chica-Starhopper-Raptor-Starship-Mk1-mockup-NASASpaceflight-bocachicagal-1-450x270.jpg,,Image not found,Teslarati
2019-09-24,Tesla’s Dog Mode helps Model S owner win animal cruelty charge,A man in Ireland has recently been cleared of animal welfare charges thanks to Tesla’s Dog Mode after local police were called...,https://www.teslarati.com/tesla-dog-mode-animal-cruelty-lawsuit/,https://www.teslarati.com/wp-content/uploads/2019/02/tesla-dog-mode-feature-450x270.jpg,,Image not found,Teslarati
2019-09-24,Leaked Tesla Gigafactory 3 photo shows ongoing Model 3 trial assembly runs,It appears that Tesla has started conducting trial assembly runs of its Model 3 sedan in Gigafactory 3. The recent update comes...,https://www.teslarati.com/tesla-gigafactory-3-model-3-trial-assembly-photos/,https://www.teslarati.com/wp-content/uploads/2019/09/tesla-model-3-giga-3-assembly-line-1-1-450x270.jpg,,Image not found,Teslarati
2019-09-24,SpaceX installs two Starship wings ahead of Elon Musk’s Saturday update,SpaceX CEO Elon Musk is just six days away from giving an updated Starship presentation and the company is working relentlessly to...,https://www.teslarati.com/spacex-kicks-off-starship-wing-installation-elon-musk-update/,https://www.teslarati.com/wp-content/uploads/2019/09/Boca-Chica-Starship-Mk1-092219-NASASpaceflight-bocachicagal-leg-2-6-crop-c-450x270.jpg,,Image not found,Teslarati
2019-09-24,Tesla Semi to kick off Yandell Truckaway’s transition to an all-electric fleet,"Following its visit to Pixar HQ for the esteemed animation studio’s green day celebration for employees, the Tesla Semi headed to the...",https://www.teslarati.com/tesla-semi-yandell-truckaway-all-electric-transition/,https://www.teslarati.com/wp-content/uploads/2019/09/tesla-semi-yandell-truckaway-6a-450x270.jpg,,Image not found,Teslarati
2019-09-24,Tesla vs Porsche: Inside the emerging Nurburgring EV arms race,"The results of Tesla’s brief time in Germany’s famed Nürburgring racetrack were impressive. During their stay, Tesla’s two Model S “Plaid” powertrain...",https://www.teslarati.com/tesla-model-s-plaid-vs-porsche-taycan-nurburgring-arms-race/,https://www.teslarati.com/wp-content/uploads/2019/09/tesla-model-s-porsche-taycan-1-450x270.jpg,,Image not found,Teslarati
2019-09-24,Tesla and SpaceX CEO Elon Musk dubbed ‘most inspiring’ leader in tech,"A recent survey involving over 3,600 workers in the tech sector has revealed that SpaceX and Tesla CEO Elon Musk is the...",https://www.teslarati.com/tesla-spacex-elon-musk-most-inspiring-leader/,https://www.teslarati.com/wp-content/uploads/2018/08/tesla-tour-elon-musk-450x270.jpg,,Image not found,Teslarati
2019-09-24,Tesla Model 3’s stellar safety ratings could lower owners’ insurance rates,"Thanks to the Tesla Model 3’s recently received Top Safety Pick+ award, owners could end up receiving lower insurance rates from providers....",https://www.teslarati.com/tesla-model-3-safety-rating-lower-insurance-rates/,https://www.teslarati.com/wp-content/uploads/2019/07/tesla-model-3-model-x-andres-ge-45-e1564091346476-450x270.jpg,,Image not found,Teslarati
2019-09-24,Tesla owner shares best look yet at Model 3’s Pedestrian Warning System,Tesla’s recently added noisemaker is beginning to get its first looks as a YouTuber recently gave an in-depth look at his Model...,https://www.teslarati.com/tesla-model-3-pedestrian-warning-system-sounds-video/,https://www.teslarati.com/wp-content/uploads/2019/09/Screen-Shot-2019-09-20-at-1.17.24-PM-e1569001055911-450x270.jpg,,Image not found,Teslarati
2019-09-24,Tesla invites UFOs to Supercharge amid day of Area 51 raid,Humans and extraterrestrials in the vicinity of the top-secret government facility Area 51 will have access to a special Tesla Supercharger in...,https://www.teslarati.com/tesla-invites-ufos-supercharges-area-51-raid/,https://www.teslarati.com/wp-content/uploads/2019/09/area-51-supercharger-450x270.jpeg,,Image not found,Teslarati
2019-09-24,Rivian patents unique airbag system for max protection during far-side collisions,"Rivian’s electric trucks are equipped with a suite of active and passive safety features, among them being a number of airbags for...",https://www.teslarati.com/rivian-center-airbag-patent/,https://www.teslarati.com/wp-content/uploads/2019/04/rivian-r1t-1-450x270.jpg,,Image not found,Teslarati
2019-09-24,"SpaceX’s Crew Dragon is pushing the envelope of parachute engineering, says NASA","On September 17th, a NASA blog post praised the progress SpaceX has made with Crew Dragon’s parachute system, indicating that the company...",https://www.teslarati.com/spacex-nasa-crew-dragon-parachute-testing-progress/,https://www.teslarati.com/wp-content/uploads/2019/09/Crew-Dragon-parachute-tests-SpaceX-1-450x270.jpg,,Image not found,Teslarati
