date,title,short_description,article_link,image,byline,alt,outlet
2019-10-30,Tesla Model 3 survey reveals much-improved build quality and a happier owners community,"An extensive survey of 5,000 Tesla Model 3 owners conducted by Bloomberg reveals that buyers are finding increasingly improved vehicle build quality...",https://www.teslarati.com/tesla-model-3-survey-improved-quality-panel-gaps/,https://www.teslarati.com/wp-content/uploads/2019/07/tesla-model-3-model-x-andres-ge-29-e1564091925937-450x270.jpg,,Image not found,Teslarati
2019-10-30,SpaceXâs Crew Dragon astronaut launch debut a step closer after SuperDraco milestone,Photos published by SpaceX reveal that the company has begun to outfit its first astronaut-capable Crew Dragon spacecraft with its eight SuperDraco...,https://www.teslarati.com/spacex-crew-dragon-astronaut-capsule-abort-engine-install/,https://www.teslarati.com/wp-content/uploads/2019/10/Crew-Dragon-C206-Demo-2-SuperDraco-install-Oct-2019-SpaceX-1-crop-c-450x270.jpg,,Image not found,Teslarati
2019-10-30,"SpaceX COO offers harsh critique of Falcon 9, Starlink, and Starshipâs competitors",SpaceX President Gwynne Shotwell says that the companyâs Starlink internet constellation is years ahead of competition from OneWeb and Amazon. A step...,https://www.teslarati.com/spacex-starlink-years-ahead-us-military-testing/,https://www.teslarati.com/wp-content/uploads/2019/08/Vulcan-Heavy-New-Glenn-Starship-renders-ULA-Blue-Origin-SpaceX-1-450x270.jpg,,Image not found,Teslarati
2019-10-29,Tesla Navigate on Autopilot to get Automatic HOV Lane detection,Tesla is expected to add an automatic High-Occupancy Vehicle (HOV) recognition feature that will enable Navigate on Autopilot to automatically utilize carpool...,https://www.teslarati.com/tesla-navigate-on-autopilot-to-get-automatic-hov-lane-detection/,https://www.teslarati.com/wp-content/uploads/2019/08/tesla-noa-waltz-450x270.jpg,,Image not found,Teslarati
2019-10-29,Tesla critic who predicted 80% value decline admits mistake: âI was wrongâ,A Clinical Professor of Marketing at NYU who predicted that Tesla is poised to lose 80% or more of its value has...,https://www.teslarati.com/tesla-tsla-elon-musk-critic-scott-galloway-admits-mistake/,https://www.teslarati.com/wp-content/uploads/2019/07/tesla-model-3-model-x-andres-ge-32-e1564091709546-450x270.jpg,,Image not found,Teslarati
2019-10-29,Tesla Model 3 long wheelbase version for Chinese market captured in spy shot,"What appears to be a Tesla Model 3 long-wheelbase (LWB) prototype has been photographed while it was road-testing in China. The vehicle,...",https://www.teslarati.com/tesla-model-3-long-wheelbase-china-spy-shots/,https://www.teslarati.com/wp-content/uploads/2019/10/tesla-long-wheelbase-model-3-china-450x270.jpg,,Image not found,Teslarati
2019-10-29,Tesla boosts Model S and Model X range ahead of upcoming OTA power upgrade,"Tesla has adjusted the listed range of its flagship Model S and Model X, listing the vehiclesâ actual range on its design...",https://www.teslarati.com/tesla-model-s-model-x-range-increase-ota-power-update/,https://www.teslarati.com/wp-content/uploads/2019/10/tesla-model-s-range-450x270.jpg,,Image not found,Teslarati
2019-10-28,SpaceXâs new Falcon 9 fairing recovery ship kicks off sea trials ahead of next launch,"After a brief installation period, SpaceXâs second Falcon 9 fairing-catching ship departed Port Canaveral to begin sea trials with its new net...",https://www.teslarati.com/spacex-falcon-9-fairing-recovery-ship-sea-trials-next-launch/,https://www.teslarati.com/wp-content/uploads/2019/10/GO-Ms-Chief-sea-trials-102319-Richard-Angle-Teslarati-6-crop-2-450x270.jpg,,Image not found,Teslarati
2019-10-28,Tesla reduces Solar + Powerwall pricing amid CA wildfire power outages,"With wildfires blazing through portions of California, Tesla CEO Elon Musk has knocked $1,000 off the price of Solar+Powerwall prices as of...",https://www.teslarati.com/tesla-reduces-solar-powerwall-pricing-elon-musk-ca-wildfire/,https://www.teslarati.com/wp-content/uploads/2019/04/tesla-powerwall-1-450x270.jpg,,Image not found,Teslarati
2019-10-28,Tesla to unlock extended range for vehicles affected in CA wildfires,Tesla owners living in areas affected by the ongoing CA wildfires will be able to tap into the maximum range offered by...,https://www.teslarati.com/tesla-range-upgrade-ca-wildfires-elon-musk/,https://www.teslarati.com/wp-content/uploads/2019/06/tesla-model-3-supercharger-450x270.jpg,,Image not found,Teslarati
2019-10-28,"Longtime Tesla bear loses bet against TSLA short-turned-bull, donates $15k to charity","Longtime Tesla (NASDAQ:TSLA) bear and critic Whitney Tilson, whose fund was shut down partly due to his bet against the electric car...",https://www.teslarati.com/tesla-tsla-short-loses-bet-15k-charity-donation/,https://www.teslarati.com/wp-content/uploads/2019/10/Gigafactory-3-Q3-2019-Tesla-body-shop-1-450x270.jpg,,Image not found,Teslarati
2019-10-28,Tesla Gigafactory 3 battery facility gets roof trusses as Model 3 fleet is spotted onsite,Recent footage of the Tesla Gigafactory 3 complex in Shanghai reveals that the roof trusses of the electric car makerâs battery facility...,https://www.teslarati.com/tesla-gigafactory-3-model-3-production-fleet-battery-factory-roof/,https://www.teslarati.com/wp-content/uploads/2019/10/tesla-gigafactory-3-phase-2-model-3-lot-450x270.jpg,,Image not found,Teslarati
2019-10-28,SpaceX president teases Starshipâs game-changing Starlink launch capabilities,SpaceX President and COO Gwynne Shotwell teased new information detailing the wealth of benefits that the next-generation Starship launch vehicle could bring...,https://www.teslarati.com/spacex-president-teases-starship-starlink-capabilities/,https://www.teslarati.com/wp-content/uploads/2019/09/Starship-2019-SpaceX-payload-bay-1-crop-2-450x270.gif,,Image not found,Teslarati
2019-10-28,"Tesla Solar Roof V3 shows a more cautious Elon Musk, and thatâs a good thing","Tesla CEO Elon Musk has previously stated that 2019 will be the year of the Solar Roof, the companyâs flagship solar product....",https://www.teslarati.com/tesla-solar-roof-v3-elon-musk-strategy-explained/,https://www.teslarati.com/wp-content/uploads/2018/12/tesla-solar-roof-powerwall-energy-450x270.jpg,,Image not found,Teslarati
2019-10-28,Mysterious Air Force spaceplane returns to Earth more than two years after SpaceX launch,"More than 25 months after it lifted off on a SpaceX Falcon 9 rocket, the US Air Forceâs secretive X-37B spaceplane successfully...",https://www.teslarati.com/mysterious-air-force-space-plane-return-spacex-launch/,https://www.teslarati.com/wp-content/uploads/2019/10/X-37B-OTV-5-post-landing-102719-USAF-2-crop-450x270.jpg,,Image not found,Teslarati
2019-10-28,Tesla Model Y bashed by auto veteran: âItâs terminally ugly. I donât know whoâs gonna buy thatâ,"The Tesla Model Y is expected to be the companyâs highest-volume vehicle yet, with Elon Musk noting during the recently-held third-quarter earnings...",https://www.teslarati.com/tesla-model-y-ugly-bob-lutz-video/,https://www.teslarati.com/wp-content/uploads/2019/09/tesla-model-y-accelerating-450x270.jpg,,Image not found,Teslarati
2019-10-28,"Tesla Model S Plaid: Everything we know â performance, features, versions and more",Elon Musk remarked during the recently-held third-quarter earnings call that Tesla is continuing the production of the Model S more for âsentimental...,https://www.teslarati.com/tesla-model-s-plaid-what-we-know-so-far/,https://www.teslarati.com/wp-content/uploads/2019/10/red-tesla-model-s-p100drear-diffuser-1-e1571578886502-450x270.jpg,,Image not found,Teslarati
2019-10-28,Tesla resumes Gigafactory 1 solar panel installations,"Tesla has resumed the buildout of its planned solar roofing system on its Gigafactory 1 in Reno, Nevada amidst the companyâs positive...",https://www.teslarati.com/tesla-resumes-gigafactory-1-solar-panel-installations/,https://www.teslarati.com/wp-content/uploads/2019/04/tesla-gigafactory-1-profile-1a-450x270.jpg,,Image not found,Teslarati
2019-10-28,"Tesla Model Y sales impact on Model 3, addressed by Elon Musk",Tesla CEO Elon Musk stated he does not expect the upcoming production and sale of the Model Y to cannibalize sales of...,https://www.teslarati.com/tesla-model-y-sales-impact-on-model-3-addressed-by-elon-musk/,https://www.teslarati.com/wp-content/uploads/2019/10/tesla-model-3-tesla-model-y-side-by-side-450x270.jpg,,Image not found,Teslarati
2019-10-28,VW CEO corrects TSLA critics: âTesla is not niche. The Model 3 is a large-series (car)â,"Less than a month after Tesla CEO Elon Musk took to Twitter to share his support for Volkswagen CEO Herbert Diess, the...",https://www.teslarati.com/elon-musk-volkswagen-ceo-corrects-tsla-critics-tesla-model-3-niche/,https://www.teslarati.com/wp-content/uploads/2018/08/Tesla-S3X-Semi-fleet-press-photo-e1548882286108-450x270.jpg,,Image not found,Teslarati
2019-10-28,Tesla overtakes GM as USâ most valuable carmaker as TSLA shorts feel $1.4B burn,"Tesla shares (NASDAQ:TSLA) ended Thursdayâs trading on a strong note, rising over 17% and ending just shy of the $300 mark at...",https://www.teslarati.com/tesla-tsla-overtakes-gm-1-billion-short-burn/,https://www.teslarati.com/wp-content/uploads/2019/07/tesla-model-3-model-x-andres-ge-45-e1564091346476-450x270.jpg,,Image not found,Teslarati
2019-10-28,SpaceXâs Crew Dragon abort test gets closer to launch with SuperDraco static fires,"SpaceX has posted a video showing the static fire test of a pod of Crew Dragon SuperDraco abort thrusters, indicating that the...",https://www.teslarati.com/spacex-crew-dragon-flight-test-thruster-static-fire/,https://www.teslarati.com/wp-content/uploads/2019/10/Crew-Dragon-SuperDraco-static-fire-Oct-2019-SpaceX-mosaic-1-450x270.jpg,,Image not found,Teslarati
2019-10-28,Tesla Model Y with Model S/X âSlipstreamâ wheels spotted long range testing in MI,"A Tesla Model Y has been spotted over 2,400 miles away from Fremont, CA, with an electric car enthusiast capturing a photo...",https://www.teslarati.com/tesla-model-y-model-s-x-wheels-long-range-test-video/,https://www.teslarati.com/wp-content/uploads/2019/10/tesla-model-y-mi-sighting-1-450x270.jpg,,Image not found,Teslarati
2019-10-28,Tesla to roll out improved Smart Summon in coming weeks,"During Teslaâs Q3 2019 earnings call, CEO Elon Musk announced the company would be using data obtained from over one-million uses of...",https://www.teslarati.com/tesla-smart-summon-update-release-elon-musk/,https://www.teslarati.com/wp-content/uploads/2019/09/tesla-smart-summon-1a-450x270.jpg,,Image not found,Teslarati
2019-10-28,"Tesla Gigafactory 4 in Europe to start Model 3, Model Y production in 2021",Tesla provided an update on its plans to establish Gigafactory 4 in Europe in its Q3 2019 Update Letter and its recently-held...,https://www.teslarati.com/tesla-gigafactory-4-europe-model-3-model-y-production-2021/,https://www.teslarati.com/wp-content/uploads/2019/08/tesla-gigafactory-4-europe-450x270.jpg,,Image not found,Teslarati
2019-10-28,Tesla Model 3 keying suspect confesses after Sentry Mode video goes viral,A Tesla Model 3 owner who fell victim to a keying incident in the San Francisco Bay Area has located the perpetrator...,https://www.teslarati.com/tesla-model-3-keying-suspect-confesses-sentry-mode-video/,https://www.teslarati.com/wp-content/uploads/2019/10/frimpong-key-incident-450x270.jpg,,Image not found,Teslarati
2019-10-28,Tesla (TSLA) Q3 2019 earnings and return to profitability: Hereâs Wall Streetâs reaction,"Tesla shares (NASDAQ:TSLA) spiked as high as 20% on the heels of its Q3 2019 earnings release, with the company posting a...",https://www.teslarati.com/tesla-tsla-q3-2019-earnings-profitability-wall-st-reaction/,https://www.teslarati.com/wp-content/uploads/2019/10/Gigafactory-3-Q3-2019-Tesla-paint-shop-1-450x270.jpg,,Image not found,Teslarati
2019-10-28,Blue Origin teases first New Glenn rocket prototype at Blue Moon lander event,"In May 2019, Blue Origin unveiled plans to build and launch “Blue Moon” lunar landers. Five months later, founder Jeff Bezos has...",https://www.teslarati.com/blue-origin-first-new-glenn-prototype-blue-moon-event/,https://www.teslarati.com/wp-content/uploads/2019/10/New-Glenn-S2-cutaway-Blue-Origin-Harris-450x270.jpg,,Image not found,Teslarati
2019-10-28,SpaceX says Starship Mk1 will test ‘skydiver’ landing before the end of 2019,"A senior SpaceX director says that the Starship Mk1 prototype could lift off for the first time before the end of 2019,...",https://www.teslarati.com/spacex-starship-mk1-skydiver-landing-test-2019/,https://www.teslarati.com/wp-content/uploads/2019/09/Starship-Mk1-Boca-Chica-092719-Teslarati-Eric-Ralph-1-c-450x270.jpg,,Image not found,Teslarati
2019-10-28,"Tesla Model S, X, 3 to get power boost via software update in coming weeks","Tesla vehicles will receive additional power increases, as well as improvements in Supercharging and drivability in the coming weeks via over-the-air software...",https://www.teslarati.com/tesla-model-s-x-3-power-boost-software-update/,https://www.teslarati.com/wp-content/uploads/2019/03/TeslaCorsa-model-3-track-mode-450x270.jpg,,Image not found,Teslarati
2019-10-28,Tesla Semi to enter limited production run in 2020 from its US facilities,"The Tesla Semi will begin limited production in 2020 from its facilities in the United States, notes the company in its third-quarter...",https://www.teslarati.com/tesla-semi-to-enter-limited-production-run-in-2020-according-to-q3-2019-update/,https://www.teslarati.com/wp-content/uploads/2019/09/tesla-semi-yandell-truckaway-8-e1569177146801-450x270.jpg,,Image not found,Teslarati
2019-10-28,LIVE BLOG: Tesla (TSLA) Q3 2019 earnings call updates,Tesla’s (NASDAQ:TSLA) third-quarter earnings call comes on the heels of a blockbuster earnings report that saw the electric car maker prove its...,https://www.teslarati.com/tesla-tsla-q3-2019-earnings-livestream-live-blog/,https://www.teslarati.com/wp-content/uploads/2019/10/Gigafactory-3-Q3-2019-Tesla-body-shop-2-450x270.jpg,,Image not found,Teslarati
2019-10-28,Tesla Model Y production to begin sooner than expected at Fremont factory,"Tesla announced in its third-quarter Update Letter that Model Y production would begin sooner than expected in its Fremont, California factory. According...",https://www.teslarati.com/tesla-model-y-production-date-summer-2020/,https://www.teslarati.com/wp-content/uploads/2019/04/Model-Y-Fremont_2a-450x270.jpg,,Image not found,Teslarati
2019-10-28,Tesla crushes Q3 2019 results and returns to profitability,"Tesla’s (NASDAQ:TSLA) third-quarter earnings for 2019 saw the electric car maker post $6.3 billion in revenue, meeting Wall Street estimates. The results,...",https://www.teslarati.com/tesla-tsla-q3-2019-earnings-results-profitable/,https://www.teslarati.com/wp-content/uploads/2017/07/Tesla-Logo-red-sign-1024x781-450x270.jpg,,Image not found,Teslarati
2019-10-28,"Tesla Model 3’s interior camera may be used for fun in-car features, says Elon Musk","Tesla’s internal camera, a device not yet utilized by the company’s vehicles, may receive a new functionality after an owner asked CEO...",https://www.teslarati.com/tesla-model-3-interior-camera-caraoke-elon-musk/,https://www.teslarati.com/wp-content/uploads/2019/10/tesla-internal-camera-450x270.jpg,,Image not found,Teslarati
2019-10-28,Top 5 things Tesla (TSLA) investors want to know from the Q3 2019 earnings call,Tesla’s (NASDAQ:TSLA) retail and institutional investors are aggregating a number of inquiries that will potentially be addressed by the electric car maker’s...,https://www.teslarati.com/tesla-tsla-retail-investors-q3-2019-questions-earnings-call/,https://www.teslarati.com/wp-content/uploads/2018/06/tesla-fremont-factory-e1529561210353-450x270.jpg,,Image not found,Teslarati
2019-10-28,"SpaceX’s Starship facilities, Raptor testing, and more shown off in new video","SpaceX has teased a video highlighting all aspects of its next-generation Starship rocket, ranging from new views of the Starship Mk1 prototype...",https://www.teslarati.com/spacex-starship-facilities-raptor-testing-new-video/,https://www.teslarati.com/wp-content/uploads/2019/10/Starship-Mk1-102219-NASASpaceflight-bocachicagal-1-crop-c-450x270.jpg,,Image not found,Teslarati
2019-10-28,"Tesla Model S Nurburgring update: A crash, more Superchargers, and new mods",Recent reports from Germany have provided some interesting new updates about Tesla’s ongoing activities at the Nürburgring. Among these was the unfortunate...,https://www.teslarati.com/tesla-model-s-nurburgring-update-crash-supercharger-spoiler/,https://www.teslarati.com/wp-content/uploads/2019/10/model-s-plaid-blue-1a-450x270.jpg,,Image not found,Teslarati
2019-10-28,Tesla Chair shares rare insights on how it’s like to oversee Elon Musk,"While speaking at the Fortune Most Powerful Women Summit in Washington, D.C. on Tuesday, Tesla’s Board Chair Robyn Denholm provided some rare...",https://www.teslarati.com/tesla-tsla-chair-overseeing-elon-musk-insights/,https://www.teslarati.com/wp-content/uploads/2018/08/tesla-tour-elon-musk-450x270.jpg,,Image not found,Teslarati
2019-10-28,SpaceX’s Starlink internet a step closer to customers as “user terminal” hiring ramps up,"As SpaceX prepares to kick off an aggressive Starlink launch campaign in the next month or two, the company is also aggressively...",https://www.teslarati.com/spacexs-starlink-internet-a-step-closer-to-customers-as-user-terminal-hiring-ramps-up/,https://www.teslarati.com/wp-content/uploads/2019/06/Starlink-coverage-Earth-SpaceX-2-crop-450x270.jpg,,Image not found,Teslarati
2019-10-28,Tesla Gigafactory 3 leak hints at Model 3 AWD production in Q1 2020,Recent leaks from Tesla Gigafactory 3’s environmental assessment have revealed that the electric car maker is looking to produce Dual Motor AWD...,https://www.teslarati.com/tesla-model-3-awd-gigafactory-3-production-q1-2020/,https://www.teslarati.com/wp-content/uploads/2019/10/gigafactory-3-night-docks-4-450x270.jpeg,,Image not found,Teslarati
2019-10-28,Rivian’s custom key fob design is a shoutout to its outdoor clientele,Rivian recently gave future owners of its R1T pickup truck and R1S SUV a peek at its intended design of the vehicles’...,https://www.teslarati.com/rivian-r1s-r1t-key-fob-design/,https://www.teslarati.com/wp-content/uploads/2019/10/Rivian-Key-fob-design-450x270.jpg,,Image not found,Teslarati
2019-10-28,"Tesla has ‘no chance’ to achieve Full Self-Driving next year, claims Zoox co-founder","Tesla’s Full Self-Driving initiatives recently received a stern dismissal from Zoox co-founder and CTO Jesse Levinson, who stated during a recent conference...",https://www.teslarati.com/tesla-elon-musk-full-self-driving-no-chance-zoox-founder/,https://www.teslarati.com/wp-content/uploads/2019/10/tesla-autopilot-450x270.jpg,,Image not found,Teslarati
2019-10-28,Tesla’s (TSLA) Q3 2019 earnings: What Wall Street is expecting,"Tesla (NASDAQ:TSLA) is heading into what could be its most important earnings results yet, with the company riding a momentum that has...",https://www.teslarati.com/tesla-tsla-q3-2019-earnings-call-wall-st-expectations/,https://www.teslarati.com/wp-content/uploads/2019/03/Model-Y-event-Elon-Musk-and-Model-S-3-X-Y-Tesla-1-450x270.jpg,,Image not found,Teslarati
2019-10-28,Tesla Model Y spotted by Model 3 owner in real world traffic conditions,A Tesla Model Y release candidate was recently spotted testing in real-world traffic conditions by a Model 3 owner during a morning...,https://www.teslarati.com/tesla-model-y-real-world-traffic-model-3-video/,https://www.teslarati.com/wp-content/uploads/2019/10/model-y-real-world-sighting-e1571746629152-450x270.jpeg,,Image not found,Teslarati
2019-10-28,"Tesla Energy backup helps SpaceX Starship Mk1 face down tornadoes, power outages",SpaceX’s South Texas Starship facilities and Mk1 prototype fell under threat of damage when stormy weather – including multiple tornadoes and heavy...,https://www.teslarati.com/spacex-starship-mk1-storm-tesla-energy-backup/,https://www.teslarati.com/wp-content/uploads/2019/10/Starship-Mk1-102119-NASASpaceflight-bocachicagal-1-crop-c-450x270.jpg,,Image not found,Teslarati
2019-10-28,The Boring Company’s Las Vegas tunnel project enters full construction phase,"The Boring Company’s transport tunnel for the Las Vegas Convention Center has entered its full construction phase, with images of the dig...",https://www.teslarati.com/elon-musk-the-boring-company-las-vegas-tunnel-update/,https://www.teslarati.com/wp-content/uploads/2019/10/the-boring-company-lvcc-450x270.jpg,,Image not found,Teslarati
2019-10-28,"Tesla Autopilot, FSD could see improvements, relaxed regulations in Europe","The full capabilities of Teslaâs Autopilot and Full-Self Driving features like Smart Summon may be available in Europe soon, as legislators are...",https://www.teslarati.com/tesla-autopilot-fsd-improvements-regulations-europe/,https://www.teslarati.com/wp-content/uploads/2019/09/Tesla-full-self-driving-visual-450x270.jpg,,Image not found,Teslarati
2019-10-28,Teslaâs âLife with Model 3â shows future owners the fun side of EV ownership,"Tesla recently launched âLife with Model 3â, a portion of the companyâs site where owners have the ability to share short clips...",https://www.teslarati.com/tesla-life-with-model-3-video/,https://www.teslarati.com/wp-content/uploads/2019/10/life-with-model-3-450x270.jpg,,Image not found,Teslarati
2019-10-28,BMW CEO denies competition from rivals like Tesla: âThere is no real newcomerâ,"New BMW CEO Oliver Zipse might be willing to save the companyâs only all-electric vehicle, but he appears to be strangely dismissive...",https://www.teslarati.com/bmw-ceo-denies-tesla-competition/,https://www.teslarati.com/wp-content/uploads/2017/08/bmw-i3-sport-edition-2-e1571677611276-450x270.jpg,,Image not found,Teslarati
2019-10-28,Tesla Model 3 wins âCar of the Yearâ award from prestigious UK auto magazine,"The Tesla Model 3 was given four separate awards, including âCar of the Year,â by a prestigious automotive magazine in the United...",https://www.teslarati.com/tesla-model-3-car-of-the-year-parkers-guide/,https://www.teslarati.com/wp-content/uploads/2019/09/model-3-sunset-450x270.jpg,,Image not found,Teslarati
2019-10-28,"Tesla Model 3 is ready for production in China, says Global VP",It appears that Teslaâs Gigafactory 3 in Shanghai is fully ready to begin the production of the Made-in-China Model 3. The remarkable...,https://www.teslarati.com/tesla-gigafactory-3-model-3-production-update-global-vp/,https://www.teslarati.com/wp-content/uploads/2019/10/gigafactory-3-oct-18-450x270.jpg,,Image not found,Teslarati
2019-10-28,SpaceXâs next Falcon 9 launch delayed until November as lull drags on,"For unknown reasons, SpaceXâs next Falcon 9 rocket launch has slipped from October to November, extending an already record-breaking lull in commercial...",https://www.teslarati.com/spacex-next-falcon-9-launch-lull-november-delay/,https://www.teslarati.com/wp-content/uploads/2019/07/Falcon-9-B1051-RCM-Radarsat-SLC-4E-rollout-video-SpaceX-2-450x270.jpg,,Image not found,Teslarati
2019-10-28,Tesla turns up vehicle safety with clever âcrash canâ patent,Teslaâs electric cars are already among the safest vehicles on the road today with their impressive safety ratings. But even the best...,https://www.teslarati.com/tesla-model-s-x-model-3-crash-rating-improvement-patent/,https://www.teslarati.com/wp-content/uploads/2019/07/model-3-ancap-450x270.jpg,,Image not found,Teslarati
2019-10-28,Tesla Roadster production car will exceed insane prototype âin every way:â Chief of Design,"Tesla Chief Designer Franz von Holzhausen recently made a rare appearance at owner-enthusiast Ryan McCaffreyâs Ride the Lightning podcast, where he provided...",https://www.teslarati.com/tesla-roadster-2020-specs-franz-von-holzhausen-interview-podcast/,https://www.teslarati.com/wp-content/uploads/2017/12/tesla-roadster-design-team-franz-450x270.jpg,,Image not found,Teslarati
2019-10-28,Tesla Roadster owned by Hollywood legend to be auctioned for cancer research,"An Original Tesla Roadster owned by Hollywood superstar Olivia Newton-John has become available for purchase in an online auction, where a portion...",https://www.teslarati.com/tesla-roadster-olivia-newton-john-auction/,https://www.teslarati.com/wp-content/uploads/2019/10/newton-john-original-roadster-e1571459420703-450x270.jpg,,Image not found,Teslarati
2019-10-28,Tesla vandal turns himself in after keying news editorâs Model 3: âI wasnât thinkingâ,A Tesla vandal recently turned himself in to authorities after a video depicting his actions was recorded by a parked Model 3âs...,https://www.teslarati.com/tesla-vandal-surrenders-sentry-mode-model-3-video/,https://www.teslarati.com/wp-content/uploads/2019/10/tesla-sentry-mode-1a-450x270.jpg,,Image not found,Teslarati
2019-10-28,Porsche and âStar Warsâ announce partnership with Taycan-Space Pod ad,Porsche has announced a partnership with popular the iconic âStar Warsâ franchise in an announcement on the German automakerâs Twitter. The Taycan...,https://www.teslarati.com/porsche-taycan-star-wars-ad-video/,https://www.teslarati.com/wp-content/uploads/2019/10/porsche-taycan-star-wars-450x270.jpg,,Image not found,Teslarati
