date,title,short_description,article_link,image,byline,alt,outlet
2019-12-02,Tesla owner Smart Summons Model 3 across a snow covered parking lot,A Tesla Model 3 owner demonstrated his vehicleâs ability to âSmart Summonâ across a snow-covered parking lot and it performed flawlessly. The...,https://www.teslarati.com/tesla-owner-smart-summons-model-3-across-a-snow-covered-parking-lot/,https://www.teslarati.com/wp-content/uploads/2019/12/tesla-model-3-smart-summon-snow-test-450x270.jpg,,Image not found,Teslarati
2019-12-02,Ford Mach-E touchscreen demo only highlights Teslaâs stark lead in user experience,"Tesla holds a lead in several aspects of the electric car market, from its battery management and efficiency to its over-the-air software...",https://www.teslarati.com/tesla-software-lead-ford-mustang-mach-e-ui-video/,https://www.teslarati.com/wp-content/uploads/2019/11/ford-mustang-mach-e-450x270.jpg,,Image not found,Teslarati
2019-12-02,Mexico Mayor orders Tesla Cybertrucks for police use: decision was âcommon senseâ,"The Tesla Cybertruck appears to be attracting more and more customers thanks to its price and utility, including those in positions of...",https://www.teslarati.com/tesla-cybertruck-order-mexico-mayor-common-sense/,https://www.teslarati.com/wp-content/uploads/2019/12/tesla-cybertruck-mexico-450x270.jpg,,Image not found,Teslarati
2019-12-02,Tesla Chinaâs battery facility shell nears completion as Model 3 fleet assembles in GF3,"Teslaâs Gigafactory 3 in China may still be waiting for its final approvals before it could start delivering the locally-produced Model 3,...",https://www.teslarati.com/tesla-gigafactory-3-battery-factory-shell-model-3-fleet-sighting-video/,https://www.teslarati.com/wp-content/uploads/2019/12/tesla-gigafactory-3-facade-450x270.jpg,,Image not found,Teslarati
2019-12-02,Tesla Model Y with matte black and chrome trim spotted at LA-Vegas Supercharger,"A Tesla Model Y with a combination of matte black window trim and Teslaâs signature chrome trim was spotted at the Barstow,...",https://www.teslarati.com/tesla-model-y-matte-black-chrome-trim-barstow-supercharger/,https://www.teslarati.com/wp-content/uploads/2019/12/tesla-model-y-barstow-supercharger-e1575277149646-450x270.jpg,,Image not found,Teslarati
2019-12-02,SpaceX Starship hardware mystery solved amid reports of Florida factory upheaval,A SpaceX Starship hardware mystery has been effectively solved after rocket parts arrived at Port Canaveral and were loaded aboard a transport...,https://www.teslarati.com/spacex-starship-hardware-mystery-solved/,https://www.teslarati.com/wp-content/uploads/2019/12/Starship-stands-dome-Port-Canaveral-120119-Greg-Scott-1-circle-c-450x270.jpg,,Image not found,Teslarati
2019-12-02,Tesla Autopilot steers around rogue barrier at construction site with ease,"Teslaâs Autopilot continues to get more refined with each new update, and if a recent video from a Model 3 owner is...",https://www.teslarati.com/tesla-autopilot-rogue-cone-construction-site-video/,https://www.teslarati.com/wp-content/uploads/2019/12/tesla-autopilot-traffic-cone-450x270.jpg,,Image not found,Teslarati
2019-12-01,Teslaâs Elon Musk explains Cybertruckâs adaptive air suspension after seeing a Ford F-350 get mangled,"For the Tesla Cybertruck to excel in the pickup truck market, it will have to exceed or at least match the utility...",https://www.teslarati.com/elon-musk-tesla-cybertruck-suspension-vs-ford-f350-video/,https://www.teslarati.com/wp-content/uploads/2019/11/tesla-cybertruck-rear-test-drive-2-450x270.jpg,,Image not found,Teslarati
2019-11-30,Tesla source code reveals Autopilot for city streets and Asia markets in focus,"Tesla appears to be laying the groundwork for the rollout of upcoming Full Self-Driving features, as well as a more widespread release...",https://www.teslarati.com/tesla-source-code-reveals-autopilot-for-city-streets-and-asia-markets-in-focus/,https://www.teslarati.com/wp-content/uploads/2019/05/tesla-model-3-san-francisco-street-city-450x270.jpg,,Image not found,Teslarati
2019-11-30,"Auto expert dubs Tesla Cybertruck as Elon Muskâs boldest, greatest creation yet","The Tesla Cybertruckâs design has been teased by Elon Musk long before it was unveiled, yet the vehicle still dropped jaws when...",https://www.teslarati.com/tesla-cybertruck-features-design-auto-expert-defense/,https://www.teslarati.com/wp-content/uploads/2019/11/Tesla-Cybertruck-unveiling-450x270.jpg,,Image not found,Teslarati
2019-11-29,Tesla Cybertruck gets high-profile order from Norwegian Justice Minister,"The Tesla Cybertruck continues to attract more and more fans, with the market now warming up to its otherwise polarizing, futuristic design....",https://www.teslarati.com/tesla-cybertruck-gets-high-profile-order-from-norwegian-justice-minister/,https://www.teslarati.com/wp-content/uploads/2019/11/tesla-cybertruck-1-450x270.jpg,,Image not found,Teslarati
2019-11-28,Tesla deploys Megapack-powered Mobile Superchargers for the holidays,"Tesla may just have figured out the perfect way to bolster its charging infrastructure during the holidays, a time when more drivers...",https://www.teslarati.com/tesla-deploys-mobile-supercharger-megapack/,https://www.teslarati.com/wp-content/uploads/2019/11/tesla-mobile-suprcharger-1-450x270.jpg,,Image not found,Teslarati
2019-11-28,Tesla Model S reaches 1 million km milestone in historic 5-year-run,Tesla Model S owner HansjÃ¶rg Gemmingen does not mind sitting on the driverâs seat and traveling long distances. Since shifting from a...,https://www.teslarati.com/tesla-model-s-1-million-miles-video/,https://www.teslarati.com/wp-content/uploads/2019/11/tesla-model-s-1-million-miles-450x270.jpg,,Image not found,Teslarati
2019-11-28,Tesla Model S âPlaidâ variants spied with center display like Model 3 in return from Nurburgring,"After setting impressive unofficial lap times at the Nurburgring, Teslaâs two Model S Plaid Powertrain prototypes have been spotted in a transport...",https://www.teslarati.com/tesla-model-s-plaid-variants-model-3-display-nurburgring-return/,https://www.teslarati.com/wp-content/uploads/2019/11/tesla-model-s-plaid-return-model-3-screen-450x270.jpg,,Image not found,Teslarati
2019-11-28,SpaceXâs Starship to spar with Blue Origin for NASA Moon landing contracts,"On November 18th, NASA announced that it had added commercial Moon lander offerings from SpaceX, Blue Origin, Sierra Nevada Corporation, and others...",https://www.teslarati.com/spacex-starship-blue-origin-nasa-moon-landing-contracts/,https://www.teslarati.com/wp-content/uploads/2019/11/Starship-2019-Moon-landing-rover-delivery-SpaceX-render-1-crop-450x270.jpg,,Image not found,Teslarati
2019-11-28,Tesla Cybertruck spotted zipping down a public street in broad daylight,"Just days following its high-profile unveiling, the Tesla Cybertruck has been spotted accelerating on a public street, followed closely by a blue...",https://www.teslarati.com/tesla-cybertruck-first-public-sighting-video/,https://www.teslarati.com/wp-content/uploads/2019/11/tesla-cybertruck-sighting-spacex-hq-450x270.jpg,,Image not found,Teslarati
2019-11-28,Rocket Labâs reusable Electron rocket upgrade gets ready for its biggest test yet,"Rocket Lab, the global leader in dedicated small satellite launches, has had quite the productive year, breaking ground on a new U.S.-based...",https://www.teslarati.com/rocket-lab-reusable-elctron-rocket-upgrade-biggest-test-yet/,https://www.teslarati.com/wp-content/uploads/2019/11/Electron-Flight-10-booster-recovery-hardware-Nov-2019-Rocket-Lab-1-circle-450x270.jpg,,Image not found,Teslarati
2019-11-27,"Audi and BMW employees face job cuts, reduced bonuses amid scramble towards EVs",German automakers Audi and BMW are facing painful cutbacks as each company attempts to accelerate its efforts towards electromobility. Based on recent...,https://www.teslarati.com/tesla-rivals-bmw-audi-job-cuts-bonus-reduction/,https://www.teslarati.com/wp-content/uploads/2019/11/bmw-audi-cutbacks-450x270.jpg,,Image not found,Teslarati
2019-11-27,Tesla Cybertruck will have Elon Muskâs flamethrower as an option,Elon Musk has hinted on Twitter that the infamous Boring Company âNot-a-Flamethrowerâ may be included as an option for the newly released...,https://www.teslarati.com/tesla-cybertruck-will-have-elon-musks-flamethrower-as-an-option/,https://www.teslarati.com/wp-content/uploads/2019/11/tesla-cybertruck-desert-450x270.jpg,,Image not found,Teslarati
2019-11-27,Tesla notifies Model Y suppliers to expedite parts production to Q4 2019: report,"Recent reports have emerged suggesting that Tesla may be looking to begin producing the Model Y sooner than expected, with suppliers reportedly...",https://www.teslarati.com/tesla-model-y-mass-production-q4-2019-parts-suppliers/,https://www.teslarati.com/wp-content/uploads/2019/03/Model-Y-Rear-34-Red-Tesla-crop-c-e1574864711591-450x270.jpg,,Image not found,Teslarati
2019-11-27,Teslaâs Cybertruck does not need traditional âtruck peopleâsâ support to succeed,"The Tesla Cybertruck is not a vehicle that could be appreciated by everyone. Uncompromisingly futuristic and angular to a fault, the vehicle...",https://www.teslarati.com/tesla-cybertruck-vs-truck-people-support/,https://www.teslarati.com/wp-content/uploads/2019/11/Cybertruck-reveal-webcast-Tesla-6-450x270.jpg,,Image not found,Teslarati
2019-11-27,SpaceX Falcon 9 booster fires up ahead of NASA launch and surprise drone ship landing,SpaceX has successfully fired up a new rocket ahead of what is now believed to be a surprise Falcon 9 booster drone...,https://www.teslarati.com/spacex-falcon-9-booster-surprise-drone-ship-landing/,https://www.teslarati.com/wp-content/uploads/2019/11/Starlink-1-Falcon-9-B1048-recovery-Nov-2019-SpaceX-1-crop-3-450x270.jpg,,Image not found,Teslarati
2019-11-27,"Tesla Cybertruck spawns dbrand vinyl skins in carbon fiber, wood and other crazy finishes",Toronto-based Dbrand best known as the maker of high-quality wraps and skins for electronic devices has shifted its focus from handheld technology...,https://www.teslarati.com/tesla-cybertruck-carbon-fiber-vinyl-wrap-dbrand/,https://www.teslarati.com/wp-content/uploads/2019/11/tesla-cybertruck-skin-wraps-450x270.jpg,,Image not found,Teslarati
2019-11-26,BMW mocks Tesla Cybertruck in social media ad for armored X5 SUV,The market may be warming up to the Tesla Cybertruck has shown in the vehicleâs 200k reservations and its spreading support among...,https://www.teslarati.com/tesla-cybertruck-mocked-bmw-x5/,https://www.teslarati.com/wp-content/uploads/2019/11/tesla-cybertruck-bmw-fisker-450x270.jpg,,Image not found,Teslarati
2019-11-26,Teslaâs Cybertruck is starting to catch the interest of industry leaders,"Teslaâs Cybertruck has caught the worldâs attention due to its polarizing design. While it is undeniably futuristic, the vehicleâs design is so...",https://www.teslarati.com/tesla-cybertruck-interest-industry-leaders/,https://www.teslarati.com/wp-content/uploads/2019/11/tesla-cybertruck-desert-run-450x270.png,,Image not found,Teslarati
2019-11-26,Ford seemingly backtracks on Tesla Cybertruck rematch: challenge was âtongue in cheekâ,"In a rather interesting turn of events, Ford appears to be backtracking somewhat from its tug-of-war rematch challenge against Teslaâs recently-revealed Cybertruck....",https://www.teslarati.com/tesla-cybertruck-vs-ford-f-150-update/,https://www.teslarati.com/wp-content/uploads/2019/11/Cybertruck-reveal-webcast-Tesla-tug-of-war-1-450x270.jpg,,Image not found,Teslarati
2019-11-26,Top 10 Tesla Cybertruck hidden features you may have missed,The Tesla Cybertruck is loaded to the teeth with technology that the vehicle is practically a mystery box of hidden features. Couple...,https://www.teslarati.com/top-10-tesla-cybertruck-hidden-features-you-may-have-missed/,https://www.teslarati.com/wp-content/uploads/2019/11/tesla-cybertruck-cup-holders-storage-450x270.jpg,,Image not found,Teslarati
2019-11-26,SpaceX Falcon 9 rideshare will test the tools needed to build space stations in orbit,A SpaceX customer has announced that one of a future Falcon 9 rideshare missions will carry a technology demonstrator designed to prove...,https://www.teslarati.com/spacex-falcon-9-rideshare-space-stations-test/,https://www.teslarati.com/wp-content/uploads/2019/08/Falcon-9-smallsat-rideshare-program-upper-stage-SpaceX-1-450x270.jpg,,Image not found,Teslarati
2019-11-26,Tesla Cybertruck to challenge Ford F-150 in tug-of-war rematch,The Tesla Cybertruck will be going head-to-head against the Ford F-150 in a tug-of-war rematch. Following a challenge from Ford X VP...,https://www.teslarati.com/tesla-cybertruck-vs-ford-f-150-tug-of-war-rematch/,https://www.teslarati.com/wp-content/uploads/2019/11/tesla-cybertruck-vs-ford-f-150-450x270.jpg,,Image not found,Teslarati
2019-11-26,Tesla Cybertruckâs âmarbleâ dashboard is actually made from paper and itâs genius,Tesla Cybertruckâs polarizing design caught the world by storm when it made its November 2019 debut in Los Angeles. Much like the...,https://www.teslarati.com/tesla-cybertruck-marble-dashboard-paper-material/,https://www.teslarati.com/wp-content/uploads/2019/11/tesla-cybertruck-paper-dashboard-450x270.jpg,,Image not found,Teslarati
2019-11-25,Elon Musk hints at smaller Tesla Cybertruck version down the road,"Following the unveiling of Teslaâs Cybertruck last week, CEO Elon Musk has hinted that a smaller version of the futuristic pickup may...",https://www.teslarati.com/elon-musk-hints-at-smaller-tesla-cybertruck-version-down-the-road/,https://www.teslarati.com/wp-content/uploads/2019/11/tesla-cybertruck-stealth-matte-black-450x270.jpg,,Image not found,Teslarati
2019-11-25,"Teslaâs Cybertruck is not a bet-the-company vehicle, and it should scare TSLA critics","The Tesla (NASDAQ:TSLA) Cybertruckâs unveiling event could have easily gone better, with the vehicleâs disruptive specs and pricing pretty much getting pushed...",https://www.teslarati.com/tesla-cybertruck-scares-tsla-shorts/,https://www.teslarati.com/wp-content/uploads/2019/11/Cybertruck-website-Tesla-3-450x270.jpg,,Image not found,Teslarati
2019-11-25,Tesla Cybertruckâs âsimpleâ design goes way deeper than you think,"Elon Muskâs Cybertruck is Teslaâs boldest vehicle yet. With its sharp edges and its unapologetically futuristic look, the Cybertruck appears to be...",https://www.teslarati.com/tesla-cybertrucks-simple-design-goes-way-deeper-than-you-think/,https://www.teslarati.com/wp-content/uploads/2019/11/tesla-cybertruck-headlights-450x270.jpg,,Image not found,Teslarati
2019-11-25,SpaceX Starlink satellite constellation aims to become worldâs largest after next launch,"In a sign of things to come next year, SpaceXâs next â and third â 60-satellite Starlink launch is officially on the...",https://www.teslarati.com/spacex-next-starlink-launch-worlds-largest-constellation/,https://www.teslarati.com/wp-content/uploads/2019/11/Starlink-satellite-bus-SpaceX-Teslarati-orbit-edit-1-1-c-450x270.jpg,,Image not found,Teslarati
2019-11-25,Tesla Cybertruckâs door handle design is a nod to the Model S,"There are a ton of impressive innovations in the Tesla Cybertuck, from its origami-style design, its clever storage spaces, to its motorized...",https://www.teslarati.com/tesla-cybertruck-model-s-door-handle-video/,https://www.teslarati.com/wp-content/uploads/2019/11/tesla-cybertruck-door-handles-1-450x270.jpg,,Image not found,Teslarati
2019-11-25,Watching Tesla Cybertruckâs âvaultâ bed cover in action is hypnotizing,The Tesla Cybertruckâs design is so bold and unapologetically sci-fi that a lot of its clever features ended up being swept under...,https://www.teslarati.com/tesla-cybertruck-vault-bed-cover-in-action-video/,https://www.teslarati.com/wp-content/uploads/2019/11/tesla-cybertruck-bed-cover-450x270.gif,,Image not found,Teslarati
2019-11-25,Tesla Model 3 Performance quietly slays Lamborghini in 1/2-mile drag race,"By now, the fact that Teslas are capable of slaying most high-performance production cars on the quarter-mile is common knowledge. With their...",https://www.teslarati.com/tesla-model-3-performance-beats-lamborghini-half-mile-drag-race-video/,https://www.teslarati.com/wp-content/uploads/2019/11/model-3-vs-huracan-450x270.jpg,,Image not found,Teslarati
2019-11-23,"Teslaâs Cybertruck will set the trend for future pickup designs, like it or not","Just over 24 hours following Tesla CEO Elon Muskâs grand unveiling of Teslaâs all-electric, rough-and-tough Cybertruck, a shift in perception has begun...",https://www.teslarati.com/tesla-cybertruck-future-of-pickup-design/,https://www.teslarati.com/wp-content/uploads/2019/11/tesla-cybertruck-wheel-450x270.jpg,,Image not found,Teslarati
2019-11-23,Teslaâs Elon Musk was offered a truck design by Nikola CEO right after Cybertruck unveiling,Nikola Motors CEO Trevor Milton has offered a more traditional truck design to Elon Musk immediately following his presentation of Teslaâs âBlade...,https://www.teslarati.com/tesla-cybertruck-design-elon-musk-tweet-nikola-ceo/,https://www.teslarati.com/wp-content/uploads/2019/11/Cybertruck-reveal-webcast-Tesla-price-1-450x270.jpg,,Image not found,Teslarati
2019-11-22,Tesla adds solar panels to Cybertruck for daily range boosts,"Teslaâs Cybertruck may be as polarizing as Elon Musk previously suggested, but its combination of affordable price, killer specs, and crazy performance...",https://www.teslarati.com/tesla-cybertruck-daily-range-boosts-solar-panels/,https://www.teslarati.com/wp-content/uploads/2019/11/tesla-cybertruck-closed-bed-storage-e1574444601543-450x270.jpg,,Image not found,Teslarati
2019-11-22,"Teslaâs electric ATV to come as option for Cybertruck pickup, says Elon Musk","Tesla CEO Elon Musk shed some light on the companyâs surprise all-electric ATV last night, stating that it would be available as...",https://www.teslarati.com/teslas-electric-atv-to-come-as-option-for-cybertruck-pickup-says-elon-musk/,https://www.teslarati.com/wp-content/uploads/2019/11/tesla-atv-front-stage-450x270.jpg,,Image not found,Teslarati
2019-11-22,Tesla Cybertruck disappoints Wall St but finds support from EV community over price and features,"True to Elon Muskâs words, the Tesla Cybertruck is a polarizing vehicle. Unapologetically futuristic and featuring a design straight out of a...",https://www.teslarati.com/tesla-tsla-cybertruck-disappoints-wall-st-buyer-support-price-function/,https://www.teslarati.com/wp-content/uploads/2019/11/tesla-cybrtrk-1-450x270.jpg,,Image not found,Teslarati
2019-11-22,Tesla Cybertruck first ride impressions: Muskâs futuristic pickup is everything I thought it wasnât,"Teslaâs new Cybertruck is as much of an all-electric pickup truck for the adventurous early adopter and high-tech consumer, as it is...",https://www.teslarati.com/tesla-cybertruck-first-ride-impressions-elon-musk-pickup/,https://www.teslarati.com/wp-content/uploads/2019/11/tesla-cybertruck-night-driving-touchscreen-450x270.jpg,,Image not found,Teslarati
2019-11-22,Boeing Starliner and SpaceX Crew Dragon crew capsules on track for back-to-back launches,NASA Commercial Crew partners Boeing and SpaceX are taking big steps towards two unique flight tests of their respective Starliner and Crew...,https://www.teslarati.com/boeing-starliner-spacex-crew-dragon-back-to-back/,https://www.teslarati.com/wp-content/uploads/2019/11/Starliner-OFT-rollout-112119-Richard-Angle-8-crop-c-450x270.jpg,,Image not found,Teslarati
2019-11-22,Tesla surprises with all-electric ATV at the end of Cybertruck event,Tesla unveiled its long-awaited Cybertruck this evening at the SpaceX rocket factory near Los Angeles. CEO Elon Musk revealed the truckâs cyberpunk...,https://www.teslarati.com/tesla-surprises-with-all-electric-atv-at-the-end-of-cybertruck-event/,https://www.teslarati.com/wp-content/uploads/2019/11/Cybertruck-reveal-webcast-Tesla-ATV-1-450x270.jpg,,Image not found,Teslarati
2019-11-21,"Tesla Cybertruck pickup: ultra hard stainless steel, 0-60 in 2.9 secs, 14k lbs towing capacity, and $40k base price","Tesla has revealed its highly-anticipated pickup truck to the public, and it is every bit the monster that CEO Elon Musk has...",https://www.teslarati.com/tesla-cybertruck-price-features/,https://www.teslarati.com/wp-content/uploads/2019/11/Cybertruck-reveal-webcast-Tesla-5-450x270.jpg,,Image not found,Teslarati
2019-11-21,Tesla patent reveals Semi truck seat suspension in the works for added safety,Tesla has submitted a patent that would improve its Semi-truckâs centered seat design by utilizing a suspension system on the architecture of...,https://www.teslarati.com/tesla-patent-reveals-semi-truck-seat-suspension-in-the-works-for-added-safety/,https://www.teslarati.com/wp-content/uploads/2019/11/semi_interior_ingress1-450x270.jpg,,Image not found,Teslarati
2019-11-21,Teslaâs futuristic âSupertruckâ pickup is over seven years in the making,"Ahead of Teslaâs Cybertruck unveiling later tonight, CEO Elon Musk went into the historical depths of his Twitter account and recovered a...",https://www.teslarati.com/teslas-futuristic-supertruck-pickup-is-over-seven-years-in-the-making/,https://www.teslarati.com/wp-content/uploads/2019/11/tesla-cybrtrk-teaser-450x270.jpeg,,Image not found,Teslarati
2019-11-21,Ex-Tesla critic and âShark Tankâ judge explains why he likes his TSLA investment,There was once a time when legendary Canadian businessman and longtime Shark Tank Judge Kevin OâLeary remarked that he hated Tesla stock...,https://www.teslarati.com/tesla-critic-shark-tank-judge-likes-tsla/,https://www.teslarati.com/wp-content/uploads/2019/11/tesla-tsla-logo-450x270.jpg,,Image not found,Teslarati
2019-11-21,US Senator wants Tesla Autopilot disabled because drivers are sleeping behind the wheel,Teslaâs Autopilot and Full Self-Driving (FSD) features received criticism from U.S. Senator Ed Markey during a Senate Commerce Committee hearing on November...,https://www.teslarati.com/tesla-autopilot-ban-us-senator-drowsy-driving/,https://www.teslarati.com/wp-content/uploads/2019/10/tesla-autopilot-450x270.jpg,,Image not found,Teslarati
2019-11-21,Tesla rolls out âGeminiâ wheels and winter tire package for Model 3 Performance,"Tesla has decided to release its previously-exclusive China series Model 3 Performance wheels, dubbed by the electric car maker as âPower Sports...",https://www.teslarati.com/tesla-gemini-wheels-model-3-performance-us-release/,https://www.teslarati.com/wp-content/uploads/2019/01/model-3-power-sports-wheels-e1546605809515-450x270.jpg,,Image not found,Teslarati
2019-11-21,SpaceX Crew Dragon tests SuperDraco rocket engines in new slow-mo video,"SpaceX has released a rare video from one of its slow-motion engineering cameras, showing off a Crew Dragon capsule performing a static...",https://www.teslarati.com/spacex-crew-dragon-superdraco-test-slow-mo-video/,https://www.teslarati.com/wp-content/uploads/2019/11/Crew-Dragon-C205-static-fire-111319-SpaceX-Behnken-Hurley-1-crop-450x270.jpg,,Image not found,Teslarati
2019-11-20,"Tesla and EV proponents call for boycott of GM, Toyota, Fiat Chrysler in new Change.org petition",A group of Tesla owners and electric vehicle proponents have initiated a new Change.org petition in hopes to boycott legacy automakers that...,https://www.teslarati.com/tesla-ev-change-org-petition-boycott-gm-toyota/,https://www.teslarati.com/wp-content/uploads/2018/11/tesla-mad-max-torture-test-la-traffic-e1541787189211-450x270.jpg,,Image not found,Teslarati
2019-11-20,SpaceX Starship blew its top during rocket fueling test (updated),Update: SpaceX has released an official statement indicating that Starship Mk1âs November 20th failure came after a decision to intentionally pressurize the...,https://www.teslarati.com/spacex-ceo-elon-musk-next-steps-starship-failure/,https://www.teslarati.com/wp-content/uploads/2019/11/Starship-Mk1-WDR-failure-112019-NASASpaceflight-bocachicagal-3-crop-edit-450x270.jpg,,Image not found,Teslarati
2019-11-20,Porsche Taycan Turbo S gets 282-mile range rating from California Air Resource Board,"The Porsche Taycan has received its certificate from the California Air Resources Board, better known as CARB, listing its range ratings for...",https://www.teslarati.com/porsche-taycan-range-282-mile-carb/,https://www.teslarati.com/wp-content/uploads/2019/09/Taycan-Turbo-S-15-450x270.jpg,,Image not found,Teslarati
2019-11-20,"Tesla patent reveals Solar module aimed at faster, more attractive installations",Tesla Solar may have taken a step back from the limelight in recent years due to the electric car makerâs efforts to...,https://www.teslarati.com/tesla-solar-system-mounting-patent/,https://www.teslarati.com/wp-content/uploads/2019/11/tesla-residential-solar-450x270.jpg,,Image not found,Teslarati
2019-11-20,Teslaâs (TSLA) market cap reaches all-time high,Tesla stock (NASDAQ:TSLA) recently hit a new milestone since it went public back more than nine years ago. Despite the electric car...,https://www.teslarati.com/tesla-tsla-market-cap-reaches-ath/,https://www.teslarati.com/wp-content/uploads/2019/10/Gigafactory-3-Q3-2019-Tesla-body-shop-1-450x270.jpg,,Image not found,Teslarati
